title,snippet,pub_date,web_url,section,source
Today’s Wordle Review,In case you need some puzzle help.,2023-11-14T08:00:01Z,https://www.nytimes.com/2023/11/14/crosswords/wordle-review.html,Gameplay,The New York Times
Jay Monahan on LIV and the Future of Golf,"In an interview, the PGA Tour commissioner discusses the deal with the Saudi-backed golf league.",2023-11-30T20:25:28Z,https://www.nytimes.com/2023/11/30/podcasts/jay-monahan.html,Podcasts,The New York Times
"These Thanksgiving Salads Are Bright, Bold and Easy","Grapefruit and herbs, apples and greens, beets and yogurt: These three pairings are designed to balance out all that holiday richness, Yewande Komolafe writes.",2022-11-09T15:56:12Z,https://www.nytimes.com/2022/11/09/dining/thanksgiving-salad-recipes.html,Food,The New York Times
The Joni Mitchell Renaissance,"A conversation about how the singer-songwriter was received during her career peak, and how she is remaking her own music in her later years.",2023-06-17T13:44:24Z,https://www.nytimes.com/2023/06/17/arts/music/popcast-joni-mitchell.html,Arts,The New York Times
Google’s Trial Heats Up + How to Wear A.I. + It’s Our Birthday!,How long can Google hold on to its jackpot of business models?,2023-10-06T09:04:23Z,https://www.nytimes.com/2023/10/06/podcasts/hard-fork-google-trial.html,Podcasts,The New York Times
‘I Don’t Think Harvard Was Good for My Soul’,What’s up with America’s misguided obsession with Ivy League schools?,2023-08-03T09:00:15Z,https://www.nytimes.com/2023/08/03/opinion/legacy-admissions-elite-colleges.html,Opinion,The New York Times
"Why TikTok Is Facing a U.S. Ban, and What Could Happen Next",The Supreme Court on Friday rejected TikTok’s challenge to a law that could effectively ban the short-form video app in the United States.,2023-03-03T13:28:56Z,https://www.nytimes.com/article/tiktok-ban.html,Technology,The New York Times
Kylie Minogue’s ‘Padam Padam’ and the Queer Club-Pop Canon,"The global star’s single has become the soundtrack of Pride this year, opening fresh conversations about pop divas and their gay fans.",2023-06-27T15:11:32Z,https://www.nytimes.com/2023/06/27/arts/music/popcast-kylie-minogue-padam-padam.html,Arts,The New York Times
A new Emmy late-night king is near.,,2023-07-12T15:59:05Z,https://www.nytimes.com/live/2023/07/12/arts/emmy-nominations/a-new-emmy-late-night-king-is-near,Arts,The New York Times
On Reading ‘Beloved’ Over and Over Again,"Salamishah Tillet, a Pulitzer-winning critic, discusses the book she has read the most over the course of her life — Toni Morrison’s classic novel of slavery and trauma.",2023-06-02T17:26:25Z,https://www.nytimes.com/2023/06/02/books/review/book-review-podcast-toni-morrison-beloved.html,Books,The New York Times
Today’s Wordle Review,In case you need some puzzle help.,2023-11-09T08:00:02Z,https://www.nytimes.com/2023/11/09/crosswords/wordle-review.html,Gameplay,The New York Times
Kevin McCarthy on His Political Future,The former speaker of the U.S. House of Representatives discusses the state of the Republican Party and questions Biden’s ability to govern at his age.,2023-11-30T10:55:02Z,https://www.nytimes.com/2023/11/30/podcasts/kevin-mccarthy-on-his-political-future.html,Podcasts,The New York Times
Mark Zuckerberg says that the App Store’s market dominance is ‘not good.’,,2022-11-30T20:00:56Z,https://www.nytimes.com/live/2022/11/30/business/dealbook-summit-conference/mark-zuckerberg-says-that-the-app-stores-market-dominance-is-not-good,Business,The New York Times
The Books We’re Looking Forward to for the Rest of the Year,"New fiction from Michael Cunningham, Sigrid Nunez and others; a candid Mitt Romney biography; and memoirs by Barbra Streisand, Britney Spears and more.",2023-10-13T17:21:41Z,https://www.nytimes.com/2023/10/13/books/review/the-books-were-looking-forward-to-for-the-rest-of-the-year.html,Books,The New York Times
Today’s Wordle Review,In case you need some puzzle help.,2023-11-15T08:00:02Z,https://www.nytimes.com/2023/11/15/crosswords/wordle-review.html,Gameplay,The New York Times
Google Turns to a Steady Old Hand to Fight Antitrust Charges,"The tech giant is facing the greatest legal threat in its history, and hopes the stolid approach of Kent Walker, its top lawyer, will once again prevail.",2023-09-06T09:01:50Z,https://www.nytimes.com/2023/09/06/technology/google-antitrust-lawyer-kent-walker.html,Technology,The New York Times
"Pandas, Ping-Pong and Profits: Chinese Leader Woos U.S. C.E.O.s","Amid frosty U.S.-China relations, Xi Jinping emphasized friendship in an address to executives from Apple, Boeing, Nike and others.",2023-11-16T12:20:36Z,https://www.nytimes.com/2023/11/16/business/economy/china-us-business-xi-jinping-ceos.html,Business,The New York Times
Why Is It So Darn Hot?,"Jennifer Szalai discusses recent books about natural history, and Jeff Goodell talks about his new climate change book, “The Heat Will Kill You First.”",2023-07-28T15:43:45Z,https://www.nytimes.com/2023/07/28/books/review/why-is-it-so-darn-hot.html,Books,The New York Times
"Actors’ Union Says It Receives ‘Last, Best and Final’ Offer From Studios","SAG-AFTRA, which has been on strike for 114 days, did not give a timeline for when it would respond.",2023-11-04T23:33:12Z,https://www.nytimes.com/2023/11/04/business/media/actors-strike-final-offer.html,Business,The New York Times
He’s the Pawpaw King of Brooklyn. (What’s a Pawpaw?),"The exotic-tasting fruit, though native to North America, is hard to come by. But in one man’s backyard near the Brooklyn-Queens Expressway, dozens fall each year.",2023-09-29T15:55:56Z,https://www.nytimes.com/2023/09/29/nyregion/pawpaw-fruit-brooklyn.html,New York,The New York Times
"Elon’s X Machina, Crypto Orbs and a Visit to Google’s Robot Lab",X marks the spot where Twitter died.,2023-07-28T09:00:16Z,https://www.nytimes.com/2023/07/28/podcasts/elons-x-machina-crypto-orbs-and-a-visit-to-googles-robot-lab.html,Podcasts,The New York Times
How My Conversations on Israel-Gaza Have Shaped My Thinking,From Zionism to cease-fires — Ezra Klein answers listeners’ questions.,2023-12-19T10:01:55Z,https://www.nytimes.com/2023/12/19/opinion/ezra-klein-podcast-ask-me-anything.html,Opinion,The New York Times
The Perils of Working on a C.E.O.’s Pet Project,Big tech companies have long been willing to fund efforts with no obvious payoff. But those groups have been hit hard in recent layoffs.,2023-03-08T10:00:33Z,https://www.nytimes.com/2023/03/08/technology/tech-big-bets-layoffs.html,Technology,The New York Times
‘Elon Musk Is Doing for Zuckerberg What Trump Did for George W. Bush’,Threads and the search for our next social media home.,2023-07-13T09:00:18Z,https://www.nytimes.com/2023/07/13/opinion/social-media-cesspool-twitter-and-threads.html,Opinion,The New York Times
‘Hello Tomorrow!’ Review: It’s Only a Paper Moon,This comedy about hustlers selling lunar condos launches with visual pizazz. The emotions take longer to land.,2023-02-16T17:30:52Z,https://www.nytimes.com/2023/02/16/arts/television/hello-tomorrow-review.html,Arts,The New York Times
What It’s Like to Write an MLK Jr. Biography,Jonathan Eig discusses his new book about the life and times of Martin Luther King.,2023-06-16T17:44:49Z,https://www.nytimes.com/2023/06/16/books/review/what-its-like-to-write-an-mlk-jr-biography.html,Books,The New York Times
Stephen King Explains Why He’s a Mystery Writer Not So Big on Mystery,"The author discusses his new novel, “Holly,” his views on writing and life, and his own influence on younger generations. And we look at September books.",2023-09-08T19:37:28Z,https://www.nytimes.com/2023/09/08/books/review/stephen-king-mystery-books-holly.html,Books,The New York Times
"TikTok Sues Montana, Calling State Ban Unconstitutional","The Chinese-owned video app filed the lawsuit days after Montana’s governor signed the ban, which takes effect on Jan. 1, into law.",2023-05-22T20:15:16Z,https://www.nytimes.com/2023/05/22/technology/tiktok-montana-ban-lawsuit.html,Technology,The New York Times
The Woke Burnout Is Real — and Politics Is Catching Up,It’s time to start asking if the culture wars actually matter to voters.,2023-09-07T09:02:27Z,https://www.nytimes.com/2023/09/07/opinion/woke-culture-wars-schools.html,Opinion,The New York Times
Revisiting ‘Bridget Jones’s Diary’ Plus the Art of Literary Translation,"Elisabeth Egan and Tina Jordan talk about Helen Fielding’s novel, and Gregory Cowles and Juliana Barbassa discuss all things translation.",2023-07-07T20:21:26Z,https://www.nytimes.com/2023/07/07/books/review/podcast-bridget-jones-diary-literary-translation.html,Books,The New York Times
Place for a Cool Dip,Zachary David Levy’s puzzle could be the next big thing.,2023-10-08T22:00:08Z,https://www.nytimes.com/2023/10/08/crosswords/daily-puzzle-2023-10-09.html,Gameplay,The New York Times
The Numbers in the News,"DealBook looks at the data points behind some of the biggest stories of the past year, and the themes that will endure in 2023.",2022-12-28T12:52:01Z,https://www.nytimes.com/2022/12/28/business/dealbook/numbers-behind-the-news-in-2022.html,Business,The New York Times
"Actors Join Writers on Strike, Bringing Hollywood to a Standstill","The dual walkouts pit more than 170,000 workers against old-line studios like Disney and Sony, as well as tech juggernauts like Netflix and Amazon.",2023-07-13T08:10:54Z,https://www.nytimes.com/2023/07/13/business/media/sag-aftra-writers-strike.html,Business,The New York Times
"Apple Ends Consulting Agreement With Jony Ive, Its Former Design Leader","Three years after promising to work “long into the future” with the man behind its candy-colored computers, Apple and Mr. Ive are through.",2022-07-12T21:14:22Z,https://www.nytimes.com/2022/07/12/technology/apple-jony-ive-end-agreement.html,Technology,The New York Times
This Philosopher Wants Liberals to Take Political Power Seriously,Danielle Allen makes the case for ‘power-sharing liberalism.’,2023-04-14T09:00:10Z,https://www.nytimes.com/2023/04/14/opinion/ezra-klein-podcast-danielle-allen.html,Opinion,The New York Times
"Popcast (Deluxe): ‘Barbie,’ Jason Aldean’s Culture War and Drake’s Tour","Plus: Violent J in our 50 Rappers, 50 Stories project, new songs and new snacks.",2023-07-26T21:14:02Z,https://www.nytimes.com/2023/07/26/arts/music/popcast-deluxe-barbie-jason-aldean-drake.html,Arts,The New York Times
The ‘Quiet Catastrophe’ Brewing in Our Social Lives,Sheila Liming examines the structural underpinnings of America’s loneliness crisis — and the art of hanging out.,2023-04-18T09:00:28Z,https://www.nytimes.com/2023/04/18/opinion/ezra-klein-podcast-sheila-liming.html,Opinion,The New York Times
The Gift of Holiday Men,The hole left by generations of absentee fathers is filled by a powerful matriarchy.,2023-07-05T20:00:10Z,https://www.nytimes.com/2023/07/05/podcasts/the-gift-of-holiday-men.html,Podcasts,The New York Times
Today’s Wordle Review,In case you need some puzzle help.,2023-12-04T08:00:02Z,https://www.nytimes.com/2023/12/04/crosswords/wordle-review.html,Gameplay,The New York Times
Bob Iger of Disney on Culture Wars and Streaming,The chief executive talks about returning to the company’s roots while adapting to changing times.,2023-11-30T21:18:58Z,https://www.nytimes.com/2023/11/30/podcasts/bob-iger-of-disney-on-culture-wars-and-streaming.html,Podcasts,The New York Times
They Propelled China’s Rise. Now They Have Nothing to Fall Back On.,"Migrant workers, who moved from China’s villages to its big cities, were a secret weapon building the economy. Now many see few options.",2023-11-01T04:01:12Z,https://www.nytimes.com/2023/11/01/business/china-rural-jobs-migrant-workers.html,Business,The New York Times
Elon Musk’s Mindset: ‘It’s a Weakness to Want to Be Liked’,"In an interview, the tech billionaire slams advertisers for pulling back from X and discusses his emotional state.",2023-11-30T10:45:03Z,https://www.nytimes.com/2023/11/30/podcasts/elon-musks-mindset-its-a-weakness-to-be-liked.html,Podcasts,The New York Times
The Museum at FIT Explores the Intersection of Food and Fashion,"Check out new vegetable varieties from Dan Barber’s Row 7, pick up a round braided challah for the holiday and more food news.",2023-09-11T19:53:48Z,https://www.nytimes.com/2023/09/11/dining/food-fashion-fit.html,Food,The New York Times
How Doctors View Patients With Disabilities,When patients with disabilities receive substandard care. Also: Kari Lake’s defeat; Mike Pence; Ukraine; South African coal; Apple’s betrayal; when to brush.,2022-11-15T16:41:43Z,https://www.nytimes.com/2022/11/15/opinion/letters/patients-doctors-disabilities.html,Opinion,The New York Times
Plenty is at stake in the first U.S. monopoly trial of the modern internet era.,,2023-09-12T13:19:13Z,https://www.nytimes.com/live/2023/09/12/business/google-antitrust-trial/plenty-is-at-stake-in-the-first-us-monopoly-trial-of-the-modern-internet-era,Business,The New York Times
"Nokia to Cut 14,000 Jobs in Major Overhaul at Telecom Giant","After a disappointing quarter, the Finnish technology company announced significant spending cuts.",2023-10-19T09:27:06Z,https://www.nytimes.com/2023/10/19/business/nokia-job-cuts.html,Business,The New York Times
Today’s Wordle Review,In case you need some puzzle help.,2023-11-20T08:00:02Z,https://www.nytimes.com/2023/11/20/crosswords/wordle-review.html,Gameplay,The New York Times
Today’s Wordle Review,In case you need some puzzle help.,2023-11-20T08:00:02Z,https://www.nytimes.com/2023/11/20/crosswords/wordle-review.html,Gameplay,The New York Times
How to Use Parental Controls on Your Child’s New Phone,"Apple and Google have upgraded their built-in software for managing the mobile experience, but you have many options for digital supervision.",2022-12-14T10:00:56Z,https://www.nytimes.com/2022/12/14/technology/personaltech/parental-controls-smartphone.html,Technology,The New York Times
Popcast (Deluxe): A.I. Pop Stars and Luke Combs’s ‘Fast Car’,"Dissecting the recent wave of songs “by"" Drake and others, plus your questions about band reunions, a rundown of new songs and more.",2023-06-14T19:09:24Z,https://www.nytimes.com/2023/06/14/arts/music/popcast-deluxe-ai-pop-luke-combs-fast-car.html,Arts,The New York Times
Our Critics’ Year in Reading,"Dwight Garner, Jennifer Szalai and Alexandra Jacobs look back on the books that have stuck with them in 2023.",2023-12-08T19:14:13Z,https://www.nytimes.com/2023/12/08/books/review/our-critics-year-in-reading.html,Books,The New York Times
Bloomberg Businessweek to Go Monthly,The publication has not avoided the persistent headwinds facing all print publications.,2023-11-30T20:16:31Z,https://www.nytimes.com/2023/11/30/business/media/bloomberg-businessweek-monthly.html,Business,The New York Times
Matthew Desmond on America’s Addiction to Poverty,The Pulitzer Prize-winning sociologist examines America’s reliance on exploiting the poor.,2023-04-21T09:00:12Z,https://www.nytimes.com/2023/04/21/opinion/ezra-klein-podcast-matthew-desmond.html,Opinion,The New York Times
Companies Are Caught in the Israel-Hamas War’s Crossfire,First it was college campuses. Now the corporate world is increasingly feeling pressure to find a balance in responding to the war.,2023-10-23T11:46:40Z,https://www.nytimes.com/2023/10/23/business/dealbook/companies-israel-hamas-war-statements.html,Business,The New York Times
Your Pies Have Arrived,"Apple, pecan, pumpkin, lemon meringue: They’re all here, as you’ve never seen them before.",2022-11-07T01:00:01Z,https://www.nytimes.com/interactive/2022/dining/thanksgiving-pies-recipes.html,Food,The New York Times
Open or Closed? Here Are Stores’ Plans for Thanksgiving and Black Friday.,Many large retailers said they planned to close their doors on Thursday.,2022-11-22T17:29:31Z,https://www.nytimes.com/2022/11/22/business/stores-open-thanksgiving-black-friday.html,Business,The New York Times
Treating Overdoses Over the Counter,It is now easier than ever to get a medication that stops overdoses.,2023-09-11T10:42:21Z,https://www.nytimes.com/2023/09/11/briefing/drug-overdoses-narcan-opioids.html,Briefing,The New York Times
"Wednesday Briefing: More Than 5,000 Dead in Libya","Plus, art from Japan’s Lost Decade.",2023-09-12T20:53:37Z,https://www.nytimes.com/2023/09/12/briefing/libya-floods-google-antitrust-softbank-arm.html,Briefing,The New York Times
Kamala Harris on Polling and Polarization,"In an interview, the vice president discusses the extent to which she follows polls and why social division is like a virus.",2023-11-30T10:50:02Z,https://www.nytimes.com/2023/11/30/podcasts/dealbook-kamala-harris.html,Podcasts,The New York Times
"In Antitrust Trial, Former Google Employee Details History of Search Deals","In the first full day of testimony in the U.S. monopoly trial against Google, the Justice Department sought to show that the company had long tried to cut out search competitors.",2023-09-13T19:05:29Z,https://www.nytimes.com/2023/09/13/technology/google-search-antitrust.html,Technology,The New York Times
Is It Time to Negotiate With Putin?,We’re past the “fairy tale stage” of the war in Ukraine. How does it end?,2023-08-31T09:03:42Z,https://www.nytimes.com/2023/08/31/opinion/american-interest-putin-war-ukraine-prigozhin.html,Opinion,The New York Times
Popcast (Deluxe): Kim Petras’s New LP and Jennifer Lawrence’s Return,"Up for discussion this week: “The Idol” approaches its finale, the conclusion of Kesha and Dr. Luke’s legal battle and more.",2023-06-28T20:21:59Z,https://www.nytimes.com/2023/06/28/arts/music/popcast-deluxe-drake-kesha-kim-petras.html,Arts,The New York Times
"Where to Stream ‘The Banshees of Inisherin,’ ‘Elvis’ and More 2023 Oscar Nominees",Many of the top contenders can be watched at home. Here’s a guide to help you get a jump on the field.,2023-01-24T19:02:02Z,https://www.nytimes.com/2023/01/24/movies/oscar-nominated-movies-streaming.html,Movies,The New York Times
"50 Rappers, 50 Stories: Behind the Scenes","A look at how we assembled a sweeping collection of personal narratives, and the threads that tie them together.",2023-07-23T00:46:44Z,https://www.nytimes.com/2023/07/22/arts/music/popcast-hip-hop-50th-anniversary.html,Arts,The New York Times
Wednesday Briefing: Zelensky’s Warning at the U.N.,"Plus, new discoveries about a nomadic clan on the island of Borneo.",2023-09-19T20:52:28Z,https://www.nytimes.com/2023/09/19/briefing/un-zelensky-biden-trudeau-india-saudi-arabia.html,Briefing,The New York Times
Why Israel Is Delaying the Ground Invasion,"More than two weeks after the attack by Hamas, Israeli troops are still massing near the Gaza border.",2023-10-25T10:00:09Z,https://www.nytimes.com/2023/10/25/podcasts/the-daily/israel-gaza-invasion.html,Podcasts,The New York Times
Jason Aldean’s Culture War Hit,"After the country star’s “Try That in a Small Town” video was criticized as offensive, right-wing support sent the song to No. 2 on the singles chart.",2023-07-28T18:01:00Z,https://www.nytimes.com/2023/07/28/arts/music/popcast-jason-aldean-small-town.html,Arts,The New York Times
Former Apple Lawyer Pleads Guilty to Insider Trading,The official was the senior director of corporate law at Apple until he was fired in late 2018.,2022-07-01T01:34:46Z,https://www.nytimes.com/2022/06/30/business/apple-levoff-insider-trading.html,Business,The New York Times
Today’s Wordle Review,In case you need some puzzle help.,2023-11-06T08:00:02Z,https://www.nytimes.com/2023/11/06/crosswords/wordle-review.html,Gameplay,The New York Times
Millions of Candies Are Recalled After Child Chokes to Death,"More than 70 million rolling candies made by two separate manufacturers pose a choking hazard to children, the U.S. Consumer Product Safety Commission said.",2023-10-06T03:36:24Z,https://www.nytimes.com/2023/10/05/us/rolling-candy-recall-choking-hazard.html,U.S.,The New York Times
The Big Number: $1.7 Trillion,"In the biggest U.S. antitrust case in 25 years, the government claims that the tech giant used monopolistic practices to become so dominant.",2023-09-08T15:43:58Z,https://www.nytimes.com/interactive/2023/09/08/business/google-antitrust-trial.html,Business,The New York Times
What a Poetic Mind Can Teach Us About How to Live,The poet Jane Hirshfield invites us to embrace habits of deep noticing and attention — and observe the beauty that unfolds.,2023-03-03T10:00:12Z,https://www.nytimes.com/2023/03/03/opinion/ezra-klein-podcast-jane-hirshfield.html,Opinion,The New York Times
Popcast (Deluxe): Is There Such a Thing as the Song of the Summer?,"Tracks by Morgan Wallen, Olivia Rodrigo, Taylor Swift and more have dominated this summer — or at least attempted to.",2023-08-16T20:56:22Z,https://www.nytimes.com/2023/08/16/arts/music/popcast-deluxe-song-of-the-summer.html,Arts,The New York Times
Theater to See in N.Y.C. This Holiday Season,"Christmas classics, comedic musicals and a star-studded Sondheim revival: a guide to the shows to see this season.",2023-11-22T19:52:54Z,https://www.nytimes.com/2023/11/22/theater/theater-to-see-in-nyc-this-holiday-season.html,Theater,The New York Times
Use Your Phone as a Pocket Tutor for Study on the Go,Apps that offer short lessons in various subjects can help get the most out of your time whether you’re waiting for a train or a meeting.,2023-08-30T13:00:22Z,https://www.nytimes.com/2023/08/30/technology/personaltech/mobile-apps-education-learning.html,Technology,The New York Times
100 Notable Books of 2022,"The year’s notable fiction, poetry and nonfiction, selected by the staff of The New York Times Book Review.",2022-11-22T17:48:17Z,https://www.nytimes.com/interactive/2022/11/22/books/notable-books.html,Books,The New York Times
Emmy Nominees 2023: The Complete List,"The 75th Emmy Awards ceremony is planned for Sept. 18, but it may be delayed because of the Hollywood writers’ strike.",2023-07-12T14:05:21Z,https://www.nytimes.com/2023/07/12/arts/television/emmy-nominees-list-2023.html,Arts,The New York Times
Tech’s Biggest Companies Are Sending Worrying Signals About the Economy,A series of quarterly earnings reports is showing that even Silicon Valley’s most powerful companies are feeling the impact of inflation and rising interest rates.,2022-10-26T22:47:44Z,https://www.nytimes.com/2022/10/26/technology/economy-facebook-google.html,Technology,The New York Times
The Risks of Storing Money in Apps Like Venmo and Cash App,The Consumer Financial Protection Bureau is warning that the funds may be at risk if the app’s parent company runs into trouble.,2023-06-09T13:00:09Z,https://www.nytimes.com/2023/06/09/your-money/venmo-cash-app-paypal-payment-apps.html,Your Money,The New York Times
A Historic Strike (and Win) for Autoworkers,"The tentative deals with Ford Motor, General Motors and Stellantis are the most generous in decades.",2023-10-31T10:00:41Z,https://www.nytimes.com/2023/10/31/podcasts/the-daily/auto-strike.html,Podcasts,The New York Times
Tripping in the Bronze Age,"A new study based on strands of hair found in a Spanish burial cave reveals that humans living about 3,000 years ago used hallucinogens, likely derived from local plants, as part of their rituals.",2023-04-06T19:21:04Z,https://www.nytimes.com/2023/04/06/science/psychedelics-bronze-age.html,Science,The New York Times
What Does Healthy Masculinity Look Like?,Men are struggling by most measures. What’s the solution?,2023-05-25T09:00:15Z,https://www.nytimes.com/2023/05/25/opinion/men-in-the-21st-century.html,Opinion,The New York Times
A.I. Is About to Get Much Weirder. Here’s What to Watch For.,"The Vox writer Kelsey Piper talks about the increasing pace of A.I. development, how it’s changing the world and what to do about it.",2023-03-21T09:00:10Z,https://www.nytimes.com/2023/03/21/opinion/ezra-klein-podcast-kelsey-piper.html,Opinion,The New York Times
Gary Oldman Found James Dean and His Wife at a Gallery,"The Oscar-winning star of “Slow Horses” on Apple TV+ likes comedians in dramas, makes photos the hard way and is still discovering the Beatles.",2022-12-05T15:00:05Z,https://www.nytimes.com/2022/12/05/arts/television/gary-oldman-slow-horses.html,Arts,The New York Times
How Much Watching Time Do You Have This Weekend?,"Our TV critic recommends an adorable kids’ show, a standup showcase and a renovation show with intriguing projects.",2023-11-30T19:47:12Z,https://www.nytimes.com/2023/11/30/arts/television/shape-island-verified-stand-up-restoration-road-with-clint-harp.html,Arts,The New York Times
Where to Stream ‘Everything Everywhere All at Once’ and More 2023 Oscar Winners,Most of the night’s winners can be watched at home. Here’s a guide to help you find the honorees.,2023-03-13T18:38:14Z,https://www.nytimes.com/2023/03/13/movies/oscar-winners-streaming.html,Movies,The New York Times
"Wait, Are There Actually Aliens?",What to make of the latest allegations of a government cover-up.,2023-06-29T09:00:27Z,https://www.nytimes.com/2023/06/29/opinion/aliens-conspiracy-theories-government-cover-ups.html,Opinion,The New York Times
The Sunday Read: ‘The Dungeons & Dragons Players of Death Row’,"For a group of men in a Texas prison, the fantasy game became a lifeline — to their imaginations, and to one another.",2023-10-08T10:00:10Z,https://www.nytimes.com/2023/10/08/podcasts/the-daily/the-sunday-read-the-dungeons-dragons-players-of-death-row.html,Podcasts,The New York Times
White Chicken Chili and a Giant Chocolate Chip Cookie,These easy recipes are sure to please.,2023-09-16T15:00:03Z,https://www.nytimes.com/2023/09/16/dining/white-chicken-chili-creamy-zaatar-spaghetti-and-a-giant-chocolate-chip-cookie.html,Food,The New York Times
