title,snippet,pub_date,web_url,section,source
The Apple-Picking Apocalypse of Upstate New York,Eight straight weekends of rain have pushed the pick-your-own orchards toward financial disaster.,2023-10-31T07:00:16Z,https://www.nytimes.com/2023/10/31/nyregion/apple-picking-new-york-rain.html,New York,The New York Times
Apple Is Doing Its Part to End Green Bubble Shaming. It’s Our Turn.,"While texting technology will soon get better, the “blue versus green bubble” disparity is far from over.",2023-11-29T14:00:10Z,https://www.nytimes.com/2023/11/29/technology/personaltech/apple-iphone-android-bubbles.html,Technology,The New York Times
The Patent Fight That Could Take Apple Watches Off the Market,A federal trade agency ruled that some Apple devices infringe on patents held by other companies.,2023-10-30T19:00:02Z,https://www.nytimes.com/2023/10/30/opinion/apple-watch-masimo.html,Opinion,The New York Times
Apple to Pause Selling New Versions of Its Watch After Losing Patent Dispute,"The move, which comes after a ruling by the International Trade Commission, could create a run on watch sales in the week before Christmas.",2023-12-18T19:12:16Z,https://www.nytimes.com/2023/12/18/technology/apple-ban-watch-sales-patent-dispute.html,Technology,The New York Times
"You Paid $1,000 for an iPhone, but Apple Still Controls It",The company codes its devices with software that complicates repairs by triggering safety warnings and malfunctions.,2023-11-12T10:00:21Z,https://www.nytimes.com/2023/11/12/technology/iphone-repair-apple-control.html,Technology,The New York Times
Apple Says It Will Improve the Green vs. Blue Texting Experience,"Longstanding texting problems between Android and Apple owners will ease next year. Among other changes, users will be able to send better-quality videos and photos.",2023-11-18T17:22:20Z,https://www.nytimes.com/2023/11/18/technology/iphone-android-apple-rcs-messaging.html,Technology,The New York Times
Apple’s Sales Drop Slightly While Profit Is Up 11 Percent,"Interest in new iPhones and services such as music and cloud storage powered the quarter, but other businesses, such as Mac sales, slowed significantly.",2023-11-02T20:59:20Z,https://www.nytimes.com/2023/11/02/technology/apple-earnings.html,Technology,The New York Times
Top Apple Executive Defends Favoring Google on iPhones,"Eddy Cue, a longtime executive at the company, said Apple’s multibillion-dollar deals with Google were driven by quality, not money.",2023-09-26T19:41:15Z,https://www.nytimes.com/2023/09/26/technology/apple-executive-google-trial-iphones.html,Technology,The New York Times
Apple’s New Film Strategy Debuts With ‘Killers of the Flower Moon’,Martin Scorsese’s three-and-a-half-hour epic is the first of three high-profile movies the tech company will give wide theatrical releases in the coming months.,2023-10-20T14:12:31Z,https://www.nytimes.com/2023/10/20/business/media/apple-killers-of-the-flower-moon-theaters.html,Business,The New York Times
Apple Unveils iPhone 15 and Switches to USB-C Charger,"European regulators passed a rule requiring USB-C charging across electronic devices, forcing the change in Apple’s newest iPhones.",2023-09-12T18:53:16Z,https://www.nytimes.com/2023/09/12/technology/apple-iphone-15-usb-c.html,Technology,The New York Times
Inside Google’s Plan to Stop Apple From Getting Serious About Search,"Google has worried for years that Apple would one day expand its internet search technology, and has been working on ways to prevent that from happening.",2023-10-26T09:00:29Z,https://www.nytimes.com/2023/10/26/technology/google-apple-search-spotlight.html,Technology,The New York Times
"In Monitoring Child Sex Abuse, Apple Is Caught Between Safety and Privacy",An advocacy group is starting a $2 million campaign calling for the company to better police materials on its products and services.,2023-09-01T18:51:18Z,https://www.nytimes.com/2023/09/01/technology/child-sex-abuse-imagery-apple-safety-privacy.html,Technology,The New York Times
Jon Stewart’s Show on Apple Is Ending,"Mr. Stewart and Apple are parting ways because of creative differences over “The Problem,” people with knowledge of the decision said.",2023-10-19T20:49:40Z,https://www.nytimes.com/2023/10/19/business/media/jon-stewart-the-problem-ends.html,Business,The New York Times
Apple Co-Founder Steve Wozniak Is ‘Doing Good’ After Minor Stroke,The technology pioneer said he was back home in California after a brief stay in a Mexico City hospital.,2023-11-10T02:02:26Z,https://www.nytimes.com/2023/11/09/technology/steve-wozniak-minor-stroke.html,Technology,The New York Times
"Apple Revenue Drops 1%, but Profit Rises to $19.88 Billion",The iPhone maker’s recent quarter benefited from strong sales in its App Store and other services businesses.,2023-08-03T20:57:30Z,https://www.nytimes.com/2023/08/03/business/apple-revenue.html,Business,The New York Times
"The Year in Apple Watches, A.I., Anarcho-Capitalists and Anticapitalists",We covered a lot of ground together in 2023.,2023-12-20T20:00:03Z,https://www.nytimes.com/2023/12/20/opinion/year-review-apple-capitalism.html,Opinion,The New York Times
‘Vague’ iPhone Alert Triggers Serious Accusations of Spying in India,"The notifications suggested that many opposition figures could be under “state-sponsored” surveillance, but even Apple said the warning could have been a false alarm.",2023-11-01T10:48:12Z,https://www.nytimes.com/2023/11/01/world/asia/india-apple-threat-notification.html,World,The New York Times
This Is Why Google Paid Billions for Apple to Change a Single Setting,Default settings on devices allow the tech industry to keep collecting and using data as it wants.,2023-11-20T10:03:33Z,https://www.nytimes.com/2023/11/20/opinion/apple-google-privacy.html,Opinion,The New York Times
How to Navigate Apple’s Shift From Lightning to USB-C,The dream of carrying one power cable for all your devices is becoming a reality. But things aren’t as simple as they sound.,2023-09-12T19:04:19Z,https://www.nytimes.com/2023/09/12/technology/personaltech/apple-iphone-lightning-usb-c.html,Technology,The New York Times
Why I Can’t Bet Against Apple’s Mixed-Reality Prowess,There are plenty of reasons the Vision Pro could flop. But we shouldn’t forget that Apple has a knack for entering a product category at just the right time.,2023-06-06T16:35:16Z,https://www.nytimes.com/2023/06/06/technology/apple-mixed-reality-vision-pro.html,Technology,The New York Times
Big Apple Circus Review: A Show That Bends Over Backward for You,"The extraordinary within the everyday: A holiday season rite returns with aerialists, trapeze acts, funny clowns (really!) and cotton candy too.",2023-11-17T19:57:20Z,https://www.nytimes.com/2023/11/17/theater/big-apple-circus-review-lincoln-center.html,Theater,The New York Times
"Apple Debuts Its Next Big Product, a Virtual Reality Headset","The device, called Vision Pro and shaped like a pair of ski goggles, faces a skeptical consumer market and competition from others, like fellow tech giant Meta.",2023-06-05T19:10:40Z,https://www.nytimes.com/2023/06/05/technology/apple-headset-virtual-reality-wwdc.html,Technology,The New York Times
Apple Knows You Didn’t Mean to Type ‘Ducking’,"Newly announced modifications to the autocorrect feature used on iPhones will better understand a word’s context in a text message, saving users some blushes.",2023-06-07T17:30:03Z,https://www.nytimes.com/2023/06/07/style/apple-autocorrect-ducking.html,Style,The New York Times
"What I’m Reading: Apples, Private Actors and Marina Abramovic",A retrospective of the performance artist’s work at the Royal Academy of Arts in London captures boundaries being violently tested and redrawn.,2023-09-29T17:22:14Z,https://www.nytimes.com/2023/09/29/world/what-im-reading-apples-private-actors-and-marina-abramovic.html,World,The New York Times
The Long Shadow of Steve Jobs Looms Over the Turmoil at OpenAI,"Sam Altman, the most prominent promoter of artificial intelligence, learned that it’s hard to be a visionary founder like the Apple legend.",2023-11-21T08:00:13Z,https://www.nytimes.com/2023/11/21/technology/sam-altman-steve-jobs.html,Technology,The New York Times
"A First Try of Apple’s $3,500 Vision Pro Headset","I briefly got my hands on Apple’s new high-tech goggles, which impressed and creeped me out and raised a question: Why do we need these?",2023-06-06T15:38:58Z,https://www.nytimes.com/2023/06/06/technology/personaltech/apple-vision-pro-headset-try.html,Technology,The New York Times
"The Big Number: $1,199",The iPhone 15 Pro Max became available on Friday and is Apple’s most expensive yet.,2023-09-22T15:52:05Z,https://www.nytimes.com/interactive/2023/09/22/business/apple-iphone-15-usb-c.html,Business,The New York Times
‘My Watch Thinks I’m Dead’,"Dispatchers for 911 are being inundated with false, automated distress calls from Apple devices owned by skiers who are very much alive.",2023-02-03T10:00:43Z,https://www.nytimes.com/2023/02/03/health/apple-watch-911-emergency-call.html,Health,The New York Times
"Apple’s Slowdown Eases, but Sluggish Demand Hurts Results","Overall iPhone sales were up, and revenue for the company’s services business set a record.",2023-05-04T21:22:46Z,https://www.nytimes.com/2023/05/04/business/apples-slowdown-eases-but-sluggish-demand-hurts-results.html,Business,The New York Times
But Would You Wear It?,Apple says its new Vision Pro headset will “shift the way we look at technology.” How about how we look?,2023-06-06T15:17:13Z,https://www.nytimes.com/2023/06/06/style/apple-vision-pro-vr-headset.html,Style,The New York Times
Worm in an Apple,What do you think this image is communicating?,2023-09-26T07:00:15Z,https://www.nytimes.com/2023/09/26/learning/worm-in-an-apple.html,The Learning Network,The New York Times
Apple Is Stepping Into the Metaverse. Will Anyone Care?,"Interest in the futuristic, immersive digital world is fading just as Apple plans to debut a virtual reality device.",2023-06-02T09:01:13Z,https://www.nytimes.com/2023/06/02/technology/apple-metaverse-vr.html,Technology,The New York Times
"China Denies Banning iPhones, but Cites Unspecified Security Concerns",The comments marked Beijing’s first public response to reports that some government agencies have told employees not to use iPhones for work.,2023-09-13T12:18:57Z,https://www.nytimes.com/2023/09/13/business/china-apple-iphone-ban.html,Business,The New York Times
Why Is Apple Getting ‘Spatial’?,"The obscure term was recently used by the world’s most valuable company in a product launch, probably in hopes that it inspires, rather than answers, questions.",2023-06-23T09:00:01Z,https://www.nytimes.com/interactive/2023/06/23/business/what-is-spatial-computing.html,Business,The New York Times
Apple Largely Prevails in Appeal of Epic Games’ App Store Suit,A Ninth Circuit panel did agree with Epic that Apple was violating California law by barring app developers from directing customers to outside payment methods.,2023-04-24T19:09:04Z,https://www.nytimes.com/2023/04/24/business/apple-epic-games-appeal.html,Business,The New York Times
"Foxconn, Apple’s Manufacturer in China, Is Said to Be Under Tax Audit",Chinese state media outlets say the Taiwanese factory giant is under investigation in four provinces. The company said it treated legal compliance as a “fundamental principle.”,2023-10-22T12:24:36Z,https://www.nytimes.com/2023/10/22/business/foxconn-china-tax-investigation.html,Business,The New York Times
"Apple Weather Fails Again, and Users Scramble",Yet another app failure was a reminder of how dependent we’ve become on our phones to tell us when the sun is shining. Here are some options if it happens again.,2023-05-09T17:36:29Z,https://www.nytimes.com/2023/05/09/technology/apple-weather-app-outage.html,Technology,The New York Times
Apple’s and Amazon’s Report Cards for the Global Economy,"The companies’ latest earnings reports provide insight into the state of consumers and businesses, including where they’re willing to spend — and cut costs.",2023-08-04T12:06:19Z,https://www.nytimes.com/2023/08/04/business/dealbook/apple-amazon-earnings-economy.html,Business,The New York Times
Chinese Warnings on iPhones Tap Deep Strain of Security Concerns,"For years, officials in China have been told to shun foreign devices. Now reports of renewed curbs have unnerved Apple’s investors, heightening geopolitical tensions.",2023-09-11T09:02:44Z,https://www.nytimes.com/2023/09/11/business/apple-china-iphones.html,Business,The New York Times
"As Smartphone Industry Sputters, the iPhone Expands Its Dominance","Apple, which is set to release a new iPhone on Tuesday, has increased its share of smartphone sales by converting Android customers and adding teenagers.",2023-09-11T09:02:24Z,https://www.nytimes.com/2023/09/11/technology/apple-iphone-17.html,Technology,The New York Times
Apple’s Market Value Falls By Billions On Worries About China Crackdown,Shares in the tech giant fell for a second day following reports that Beijing would bar government workers from using iPhones.,2023-09-07T11:49:06Z,https://www.nytimes.com/2023/09/07/business/iphone-ban-apple-china.html,Business,The New York Times
Apple’s New App Aims to Make Classical Music More Accessible,The company says it has a fix for the unwieldy world of classical streaming. But it’s unclear how much traction a stand-alone app can get.,2023-04-02T14:54:31Z,https://www.nytimes.com/2023/04/02/arts/music/apple-music-classical-streaming.html,Arts,The New York Times
What if Wine and Cider Had a Baby?,"A growing number of producers are fermenting grapes, apples and other fruits together, or blending wine and ciders, to make fascinating beverages.",2023-11-02T17:27:22Z,https://www.nytimes.com/2023/11/02/dining/drinks/wine-cider.html,Food,The New York Times
"Apple Opens First Store in India, a Promising Frontier for the Tech Giant","Tim Cook, the chief executive of the iPhone maker, visited Mumbai to inaugurate the store. Apple is pushing to expand its market share in India, as well as shift some production there.",2023-04-18T15:35:44Z,https://www.nytimes.com/2023/04/18/business/apple-stores-india-tim-cook.html,Business,The New York Times
"Pick Pumpkins, Pick Apples and Get Out of Town",Ideas to interact with nature this month.,2023-10-02T04:02:05Z,https://www.nytimes.com/2023/10/02/nyregion/pick-pumpkins-pick-apples-and-get-out-of-town.html,New York,The New York Times
Advertisers Flee X as Outcry Over Musk’s Endorsement of Antisemitic Post Grows,"Disney, Apple, Paramount and Lionsgate halted marketing on X, formerly Twitter, as Elon Musk faced a furor over antisemitic abuse on his social media platform.",2023-11-17T22:50:43Z,https://www.nytimes.com/2023/11/17/technology/elon-musk-twitter-x-advertisers.html,Technology,The New York Times
Can Apple Take the Metaverse Mainstream?,"The iPhone maker is making a bold bet that it can redefine the niche category of virtual reality with its $3,500 goggles.",2023-06-06T11:30:07Z,https://www.nytimes.com/2023/06/06/business/dealbook/apple-metaverse-virtual-reality.html,Business,The New York Times
A report of a Pegasus attack on one Russian journalist sets off a flurry of concern among others.,Apple has sent notifications to at least several more Russian reporters and editors that their cellphones might be under “state-sponsored” attacks.,2023-09-14T22:41:17Z,https://www.nytimes.com/2023/09/14/world/europe/galina-timchenko-meduza-pegagus-spyware-russia.html,World,The New York Times
"At Apple, Rare Dissent Over a New Product: Interactive Goggles",The company is expected to unveil an augmented reality headset in a few months. Some employees wonder if the device makes sense for Apple.,2023-03-26T14:11:41Z,https://www.nytimes.com/2023/03/26/technology/apple-augmented-reality-dissent.html,Technology,The New York Times
An L.A. Diner That’s Been Obsessing Over Its Burgers and Pies Since 1947,"The Apple Pan, a no-frills fixture on the city’s West Side, is a time machine that still runs like clockwork.",2023-08-03T19:03:10Z,https://www.nytimes.com/2023/08/03/t-magazine/apple-pan-los-angeles-diner.html,T Magazine,The New York Times
Google’s Photo App Still Can’t Find Gorillas. And Neither Can Apple’s.,Eight years after a controversy over Black people being mislabeled as gorillas by image analysis software — and despite big advances in computer vision — tech giants still fear repeating the mistake.,2023-05-22T09:00:15Z,https://www.nytimes.com/2023/05/22/technology/ai-photo-labels-google-apple.html,Technology,The New York Times
Google C.E.O. Says Tech Giant Has Improved the Web for All Consumers,"Sundar Pichai, the chief executive of Google, appeared in court to defend his company against a landmark federal antitrust case.",2023-10-30T16:35:24Z,https://www.nytimes.com/2023/10/30/technology/google-sundar-pichai-antitrust-trial.html,Technology,The New York Times
"Apple’s Face Computer, Crypto Chaos and How Teens Really Feel About Social Media",This isn’t the first time Apple has introduced a bulky piece of hardware that nobody is sure people will want to buy. Can Apple pull off another wearable revolution?,2023-06-09T09:00:12Z,https://www.nytimes.com/2023/06/09/podcasts/hard-fork-apple-vision-pro.html,Podcasts,The New York Times
Apple Built Its Empire With China. Now Its Foundation Is Showing Cracks.,Lawmakers’ objections to an obscure Chinese semiconductor company and tough Covid-19 restrictions are hurting Apple’s ability to make new iPhones in China.,2022-11-07T23:23:00Z,https://www.nytimes.com/2022/11/07/business/apple-china-ymtc.html,Business,The New York Times
A Silicon Valley Supergroup Is Coming Together to Create an A.I. Device,"OpenAI’s Sam Altman, the former Apple designer Jony Ive and SoftBank’s Masayoshi Son are teaming up to develop a device that could replace the smartphone.",2023-09-28T20:21:57Z,https://www.nytimes.com/2023/09/28/technology/openai-apple-silicon-valley-supergroup-create-ai-device.html,Technology,The New York Times
"Katie Cotton, Who Helped Raise Apple’s Profile, Dies at 57","As head of public relations, she worked closely with Steve Jobs, the company’s visionary chief executive, to spread the word about products like the iMac and the iPhone.",2023-05-05T02:12:46Z,https://www.nytimes.com/2023/05/04/business/katie-cotton-dead.html,Business,The New York Times
Apple Revenue and Profit Down as iPhone Sales Slow,The iPhone maker said sales of its flagship product were down 8 percent as it dealt with a factory shutdown and worries about rising inflation.,2023-02-02T22:13:35Z,https://www.nytimes.com/2023/02/02/technology/apple-revenue-profit-iphone-sales-slow.html,Technology,The New York Times
Regulators Find Apple’s Secrecy Violates Workers’ Rights,"After a yearlong investigation, a federal labor board determined that the tech giant’s rules interfere with employees’ right to organize.",2023-01-31T17:39:19Z,https://www.nytimes.com/2023/01/31/technology/apple-workers-rights.html,Technology,The New York Times
‘Unprecedented’ Secrecy in Google Trial as Tech Giants Push to Limit Disclosures,Efforts to seal testimony have increasingly raised questions as the federal antitrust case enters its third week in court.,2023-09-26T13:26:11Z,https://www.nytimes.com/2023/09/26/technology/google-antitrust-trial-secrecy.html,Technology,The New York Times
"Don’t Be Afraid of the iPhone’s NameDrop Feature, Experts Say",Police departments have issued warnings about a new Apple setting that lets users exchange contact information by bringing their devices together. Tech experts say the fears are overblown.,2023-11-29T14:56:18Z,https://www.nytimes.com/2023/11/29/technology/namedrop-apple-iphone-police.html,Technology,The New York Times
Consumer Bureau Seeks to Supervise Digital Payment Apps,"A proposed rule would subject Google, Apple, PayPal and other digital wallet providers to the same scrutiny that banks face.",2023-11-07T17:01:41Z,https://www.nytimes.com/2023/11/07/business/cfpb-paypal-venmo-cashapp.html,Business,The New York Times
"Strong First Weekend for ‘Killers,’ but Taylor Swift Was Still No. 1",The Scorsese film’s estimated $23 million in the North American box office was a special feat considering its length and the lack of promotion by its actors.,2023-10-22T16:09:30Z,https://www.nytimes.com/2023/10/22/business/media/killers-of-the-flower-moon-movie-box-office.html,Business,The New York Times
Spotify Gave Subscribers Music and Podcasts. Next: Audiobooks.,"A year after adding à la carte sales of audiobooks, Spotify is offering paying subscribers 15 hours of books a month.",2023-10-03T20:15:13Z,https://www.nytimes.com/2023/10/03/technology/spotify-audiobooks.html,Technology,The New York Times
Apple Reaches Deal With Investors to Audit Its Labor Practices,"The tech giant will assess its compliance with its official human rights policy, according to a federal filing.",2023-01-17T16:00:08Z,https://www.nytimes.com/2023/01/17/business/economy/apple-labor.html,Business,The New York Times
"Companies Are Taking a Harder Line on Union Organizers, Workers Say","Apple, Starbucks, Trader Joe’s and REI are accused of targeting union supporters after organizing efforts gained traction, charges the companies deny.",2023-05-22T15:17:24Z,https://www.nytimes.com/2023/05/22/business/economy/unions-starbucks-apple-rei-trader-joes.html,Business,The New York Times
"A Central Park Garden, Renewed",Rows of new crab apple trees are being carefully planted to replace dying ones as part of the Conservatory Garden's multi-year restoration.,2023-10-26T17:27:38Z,https://www.nytimes.com/interactive/2023/10/26/nyregion/central-park-conservatory-garden-trees.html,New York,The New York Times
Read the document,"In this 2017 internal Google document, an executive compares the search ads business to that of selling cigarettes or drugs. The executive testified at the trial that he produced the document during a communications training where he was practicing how to use hyperbole to get someone’s attention.",2023-10-23T17:21:54Z,https://www.nytimes.com/interactive/2023/10/23/business/google-trial-drug-cartel.html,Business,The New York Times
"Hulu, HBO and Apple TV+ Know What You’re Going Through at Work","Workplace shows, a hit genre of the streaming era, are homing in on a knotty question: Do you have to sacrifice personal happiness to excel at your job?",2023-10-22T07:00:28Z,https://www.nytimes.com/2023/10/22/style/work-place-streaming-shows.html,Style,The New York Times
Tuesday Briefing: Aid Trickles In to Morocco,"Also, a Q&A with Elon Musk’s biographer.",2023-09-11T20:37:56Z,https://www.nytimes.com/2023/09/11/briefing/morocco-earthquake-kim-jong-un-russia-china-iphone.html,Briefing,The New York Times
The Google Trial Is Going to Rewrite Our Future,These prosecutions typically spark innovation in unexpected ways.,2023-09-18T09:01:47Z,https://www.nytimes.com/2023/09/18/opinion/contributors/google-antitrust-trial.html,Opinion,The New York Times
"How Siri, Alexa and Google Assistant Lost the A.I. Race","The virtual assistants had more than a decade to become indispensable. But they were hampered by clunky design and miscalculations, leaving room for chatbots to rise.",2023-03-15T09:00:28Z,https://www.nytimes.com/2023/03/15/technology/siri-alexa-google-assistant-artificial-intelligence.html,Technology,The New York Times
Apple Expands Pricing for Apps,"At a time of rising inflation, the company is introducing 600 options that could free developers from the days of charging 99 cents.",2022-12-06T20:55:40Z,https://www.nytimes.com/2022/12/06/technology/apple-apps-prices.html,Technology,The New York Times
Another Google Antitrust Battle Reaches Court in Epic Games Case,"The Fortnite creator accuses Google of stifling app competition, a challenge on top of a federal suit claiming the tech giant abuses its search dominance.",2023-11-05T10:01:15Z,https://www.nytimes.com/2023/11/05/technology/google-epic-antitrust-trial.html,Technology,The New York Times
"The Best Movies and TV Shows Coming to HBO, Hulu, Apple TV+ and More in October","Here’s the best of what’s coming to Amazon, Max, Apple TV+ and others.",2023-10-05T16:43:17Z,https://www.nytimes.com/2023/10/05/arts/television/october-streaming-movies-tv-shows.html,Arts,The New York Times
How Big Tech Camouflaged Wall Street’s Crisis,"Investors in the S&P 500 are highly dependent on the fate of Microsoft, Apple and other big technology stocks. A rally in March showed how this can mask turmoil in the rest of the market.",2023-03-31T09:00:15Z,https://www.nytimes.com/2023/03/31/business/tech-stocks-sp-500.html,Business,The New York Times
What the U.S. Has Argued in the Google Antitrust Trial,"As the government wraps up its case in the landmark monopoly trial, it has built a picture of how Google became dominant in online search — and the harms that it says resulted.",2023-10-25T09:02:34Z,https://www.nytimes.com/2023/10/25/technology/google-antitrust-trial.html,Technology,The New York Times
Apple Details Plans to Beef Up Encryption of Data in Its iCloud,The move could frustrate law enforcement efforts to circumvent the already tough security of iPhones.,2022-12-07T21:28:15Z,https://www.nytimes.com/2022/12/07/technology/apple-icloud-encryption-security.html,Technology,The New York Times
5 Things to Do This Weekend,"Selections from the Weekend section, including a review of the film ""Fingernails.""",2023-11-03T09:03:15Z,https://www.nytimes.com/interactive/2023/11/03/arts/weekend-editors-picks-fingernails.html,Arts,The New York Times
