title,snippet,pub_date,web_url,section,source
The Sunday Read: ‘The Moral Crisis of America’s Doctors’,"The corporatization of health care has changed the practice of medicine, causing many physicians to feel alienated from their work.",2023-07-16T10:00:08Z,https://www.nytimes.com/2023/07/16/podcasts/the-daily/the-sunday-read-the-moral-crisis-of-americas-doctors.html,Podcasts,The New York Times
The Sunday Read: ‘The Genius Behind Hollywood’s Most Indelible Sets’,"How Jack Fisk, the master production designer behind “Killers of the Flower Moon” and many other films, brings the past to life.",2023-10-22T10:00:20Z,https://www.nytimes.com/2023/10/22/podcasts/the-daily/fisk-killers-of-the-flower-moon.html,Podcasts,The New York Times
Speaking Minionese and More: The Week in Reporter Reads,"Articles from around The Times, narrated just for you.",2023-10-13T13:33:09Z,https://www.nytimes.com/2023/10/13/podcasts/simlish-ai-birkenstocks.html,Podcasts,The New York Times
The Spoiler Threat of R.F.K. Jr.,"Robert F. Kennedy Jr. will continue his run for president as an independent, a move that could alter the dynamics of the 2024 election.",2023-10-12T10:00:12Z,https://www.nytimes.com/2023/10/12/podcasts/the-daily/rfk-2024-election.html,Podcasts,The New York Times
"Lemon Yogurt Cheesecake, Furikake Snack Mix and All the Cookies",In other words: How to ace your next holiday shindig.,2023-12-13T16:00:04Z,https://www.nytimes.com/2023/12/13/dining/lemon-yogurt-cheesecake-furikake-snack-mix-and-all-the-cookies.html,Food,The New York Times
"Lionel Messi, Soccer’s Most Coveted Free Agent, Picks Miami","Days after he announced he would not return to Paris St.-Germain, Messi, Argentina’s World Cup hero, said he planned his next stop to be Inter Miami of M.L.S.",2023-06-07T19:24:59Z,https://www.nytimes.com/2023/06/07/sports/soccer/lionel-messi-inter-miami-mls.html,Sports,The New York Times
Hearing Colors and Tasting Sounds: What Is Synesthesia?,We are honoring the top 10 winners of our Student STEM Writing Contest by publishing their essays. This one is by Erica Frischauf.,2023-04-12T14:17:53Z,https://www.nytimes.com/2023/04/12/learning/hearing-colors-and-tasting-sounds-what-is-synesthesia.html,The Learning Network,The New York Times
A Thanksgiving Road Map,We have a plan to help you prepare for the holiday — and stay sane.,2023-11-18T11:23:14Z,https://www.nytimes.com/2023/11/18/briefing/thanksgiving-road-map.html,Briefing,The New York Times
Did Hollywood Writers Get Their Happy Ending?,How one of the longest strikes in the history of movies and television ended in a tentative deal.,2023-09-27T10:00:06Z,https://www.nytimes.com/2023/09/27/podcasts/the-daily/writers-strike.html,Podcasts,The New York Times
One of the Biggest Cable Companies Says Cable TV Isn’t Working,Charter Communications told investors Friday that its fraught negotiation with Disney was a sign of a larger problem with the traditional cable-TV business model.,2023-09-01T14:37:21Z,https://www.nytimes.com/2023/09/01/business/charter-disney-cable-fight.html,Business,The New York Times
Sam Altman Is Said to Be Discussing Return to OpenAI With Company’s Board,"Mr. Altman was forced out of the artificial intelligence start-up on Friday, leading to an outcry from his supporters and the company’s investors.",2023-11-19T00:42:56Z,https://www.nytimes.com/2023/11/18/technology/sam-altman-openai-board.html,Technology,The New York Times
What We’re Reading,Plus: Recommendations from the Book Review poetry editor Greg Cowles,2023-04-07T17:13:47Z,https://www.nytimes.com/2023/04/07/books/review/what-were-reading.html,Books,The New York Times
A New Threat: Surprise Hurricanes,"Hurricane Otis transformed from a tropical storm to a deadly Category 5 hurricane in a day, defying forecasts.",2023-10-27T10:00:10Z,https://www.nytimes.com/2023/10/27/podcasts/the-daily/hurricane-otis.html,Podcasts,The New York Times
What Biden Understands About Negotiating That Obama Never Did,And other reflections on the fight over America’s debt ceiling.,2023-06-01T09:00:13Z,https://www.nytimes.com/2023/06/01/opinion/united-states-debt-ceiling.html,Opinion,The New York Times
What happened during SpaceX’s Starship test flight.,,2023-11-18T15:02:28Z,https://www.nytimes.com/2023/11/18/science/what-happened-during-spacexs-starship-test-flight.html,Science,The New York Times
Peach Cobbler as You’ve Never Seen It,"Melissa Clark flips the classic on its head, letting flaky biscuits serve as a base for juicy, caramelized peaches.",2023-08-02T14:31:47Z,https://www.nytimes.com/article/upside-down-peach-cobbler-recipe.html,Food,The New York Times
How Fred again.. Jolted Dance Music,"A conversation about the genre’s new wave of big-tent ambition, and the whimsical British artist at the heart of it.",2023-04-24T21:29:34Z,https://www.nytimes.com/2023/04/24/arts/music/popcast-fred-again.html,Arts,The New York Times
This Book Changed My Relationship to Pain,The pain psychologist Rachel Zoffness explains how pain is a “biopsychosocial phenomenon” — and how we can better treat it as such.,2023-02-21T10:00:07Z,https://www.nytimes.com/2023/02/21/opinion/17eks-ezra-klein-podcast-rachel-zoffness.html,Opinion,The New York Times
5 Tips to Declutter a Home Office,These are the tools and tricks that'll help clear your desk.,2023-08-25T15:48:43Z,https://www.nytimes.com/interactive/2023/08/25/smarter-living/wirecutter/home-office-declutter.html,Smarter Living,The New York Times
"Apple Workers at Maryland Store Vote to Unionize, a First in the U.S.","Roughly two-thirds of employees at the store in Towson, Md., voted to join the union.",2022-06-19T00:38:30Z,https://www.nytimes.com/2022/06/18/technology/apple-union-maryland.html,Technology,The New York Times
"Apple Workers at Maryland Store Vote to Unionize, a First in the U.S.","Roughly two-thirds of employees at the store in Towson, Md., voted to join the union.",2022-06-19T00:38:30Z,https://www.nytimes.com/2022/06/18/technology/apple-union-maryland.html,Technology,The New York Times
"Gold Bars, Wads of Cash and a Senator’s Indictment","The explosive details of the corruption case against Senator Robert Menendez and his wife, Nadine.",2023-09-26T10:00:11Z,https://www.nytimes.com/2023/09/26/podcasts/the-daily/senator-menendez-corruption.html,Podcasts,The New York Times
Kenji López-Alt’s Family Loves This Soup. Here’s How He Made It Easier.,"Roast the squash and aromatics in a Dutch oven, blend it all in the pot with stock and dinner’s done.",2023-02-10T19:06:32Z,https://www.nytimes.com/2023/02/10/dining/easy-one-pot-squash-soup-recipe.html,Food,The New York Times
David Grann on the Wreck of the H.M.S. Wager,"The New Yorker staff writer discusses his new book, “The Wager,” about the harrowing circumstances and conflicting stories surrounding a 1741 shipwreck.",2023-04-21T20:03:39Z,https://www.nytimes.com/2023/04/21/books/review/david-grann-on-the-wreck-of-the-hms-wager.html,Books,The New York Times
Remembering Martin Amis,"The Times critics Dwight Garner and Jason Zinoman celebrate the life and work of the great British novelist and literary critic, who died last week.",2023-05-26T17:32:19Z,https://www.nytimes.com/2023/05/26/books/review/book-review-podcast-martin-amis.html,Books,The New York Times
Fall Vibes,Temperatures are falling. It’s time for apples and squash.,2022-09-30T17:00:01Z,https://www.nytimes.com/2022/09/30/dining/fall-vibes.html,Food,The New York Times
A New Race to the Moon,What India’s success in landing a robotic craft at the moon’s south pole means for international competition in space.,2023-08-28T10:00:08Z,https://www.nytimes.com/2023/08/28/podcasts/the-daily/india-moon-landing.html,Podcasts,The New York Times
He Tried to Save a Friend. They Charged Him With Murder.,A new set of tougher laws around the drug fentanyl turned an overdose into a murder case.,2023-09-22T10:00:07Z,https://www.nytimes.com/2023/09/22/podcasts/the-daily/fentanyl-murder.html,Podcasts,The New York Times
"On Social Media, People Face Pressure to Speak Out About the War","Silence is viewed by many as its own statement. Posting, though, can come with costs, including angry outpourings and even personal attacks.",2023-11-02T15:51:43Z,https://www.nytimes.com/2023/11/02/business/social-media-israel-hamas-conflict.html,Business,The New York Times
Google News Blocked in Russia as Feud With Mercenary Leader Intensifies,"At least five telecommunications companies have blocked the service, which aggregates news from various sources, according to an analysis from NetBlocks, an internet observatory.",2023-06-24T00:30:49Z,https://www.nytimes.com/2023/06/23/world/europe/google-news-russia-prigozhin.html,World,The New York Times
The G.O.P. Primary: ‘City on a Hill’ or ‘American Carnage’?,What the emerging field of candidates says about the future of the Republican Party.,2023-05-18T09:00:10Z,https://www.nytimes.com/2023/05/18/opinion/gop-primary-desantis-trump.html,Opinion,The New York Times
"The Arm-Twisting, Back-Stabbing Battle for House Speaker","Representative Jim Jordan, known for trying to obstruct the government, has emerged as the Republican most likely to win the job.",2023-10-17T10:00:05Z,https://www.nytimes.com/2023/10/17/podcasts/the-daily/jordan-republican-speaker.html,Podcasts,The New York Times
"Taco Soup Is Summer and Fall in One Spicy, Satisfying Bowl","Also bright and comforting: spiced eggplant with tomatoes and runny eggs, Melissa Clark’s genius twist on shakshuka.",2023-08-30T15:00:04Z,https://www.nytimes.com/2023/08/30/dining/taco-soup-recipe.html,Food,The New York Times
Did the Tesla Story Ever Make Sense?,“Cool” doesn’t necessarily deliver sustained advantage.,2022-12-27T18:58:03Z,https://www.nytimes.com/2022/12/27/opinion/tesla-stock-elon-musk.html,Opinion,The New York Times
"Formula 1 Returns to Screens, This Time With Brad Pitt","A new film is shooting alongside the action at Grands Prix and, with Lewis Hamilton’s help, is being made by the director of “Top Gun: Maverick.”",2023-07-28T09:01:36Z,https://www.nytimes.com/2023/07/28/sports/autoracing/f1-brad-pitt.html,Sports,International New York Times
Inside the Sputtering Campaign of Ron DeSantis,The Florida governor began the 2024 Republican race as a front-runner. What went wrong?,2023-08-21T10:00:17Z,https://www.nytimes.com/2023/08/21/podcasts/the-daily/desantis-campaign.html,Podcasts,The New York Times
How the $500 Billion Attention Industry Really Works,"Your attention is constantly being bought, packaged and sold. Tim Hwang explains how.",2023-02-14T10:00:11Z,https://www.nytimes.com/2023/02/14/opinion/ezra-klein-podcast-tim-hwang.html,Opinion,The New York Times
Inside Ukraine’s Drone Attacks on Russia,A New York Times investigation shows the growth of Ukraine’s efforts to strike beyond its borders.,2023-09-19T10:00:12Z,https://www.nytimes.com/2023/09/19/podcasts/the-daily/ukraine-drones.html,Podcasts,The New York Times
"Botox, Hermès and OnlyFans: Why This May Be George Santos’s Last Week in Congress",Representative George Santos is facing a new expulsion push after a damning ethics report.,2023-11-27T11:00:06Z,https://www.nytimes.com/2023/11/27/podcasts/the-daily/santos-house-ethics.html,Podcasts,The New York Times
33 Reading Recommendations for Your Summer Vacation,"Whether you’re into mysteries or the making of mob movies, we’ve got something for you.",2023-07-20T09:00:12Z,https://www.nytimes.com/2023/07/20/opinion/book-recommendations-summer-vacation.html,Opinion,The New York Times
Berkshire Hathaway Posts Quarterly Profit of Nearly $36 Billion,A rebound in performance at the Geico car insurer helped offset declines in the conglomerate’s freight railroad business.,2023-08-05T14:32:44Z,https://www.nytimes.com/2023/08/05/business/berkshire-hathaway-earnings.html,Business,The New York Times
Three Great Documentaries to Stream,"In this month’s picks, an actor and a director reflect on their careers, while another director reflects on everything else.",2023-10-31T14:45:26Z,https://www.nytimes.com/2023/10/31/movies/documentaries-streaming.html,Movies,The New York Times
"The Retrievals, Season 1, Episode 2: The Nurse",From Serial Productions: Patients know what happened to them at the clinic. Now they find out who did it.,2023-07-06T10:00:03Z,https://www.nytimes.com/2023/07/06/podcasts/serial-the-retrievals-yale-fertility-clinic.html,Podcasts,The New York Times
From LSD to I.P.O.,"Once the symbol of the counterculture, lately the darlings of the fashion world, Birkenstock went public in New York.",2023-10-11T15:38:06Z,https://www.nytimes.com/2023/10/11/style/birkenstock-ipo.html,Style,The New York Times
The Sunday Read: ‘The Vanishing Family: Life in the Shadow of a Cruel Genetic Mutation’,They all have a 50-50 chance of inheriting a terrible genetic mutation — which means disappearing into dementia in middle age. This is the story of what it’s like to live with those odds.,2023-08-06T10:00:09Z,https://www.nytimes.com/2023/08/06/podcasts/the-daily/gene-dementia.html,Podcasts,The New York Times
Serial Productions,Serial Productions makes narrative podcasts whose quality and innovation transformed the medium.,2022-11-15T20:52:53Z,https://www.nytimes.com/interactive/2022/podcasts/serial-productions.html,Podcasts,The New York Times
The Tao of Rick Rubin,The legendary music producer shares practices for cultivating creativity and a more open mind.,2023-02-10T10:00:08Z,https://www.nytimes.com/2023/02/10/opinion/ezra-klein-podcast-rick-rubin.html,Opinion,The New York Times
Ousted OpenAI C.E.O. Makes Plans for New Artificial Intelligence Company,"Sam Altman, who was forced out of his company on Friday afternoon, was quickly moving to create another company with another OpenAI executive who quit on Friday.",2023-11-18T23:00:02Z,https://www.nytimes.com/2023/11/18/technology/ousted-openai-ceo-makes-plans-for-new-artificial-intelligence-company.html,Technology,The New York Times
Text Messaging Is Cool. But Where Are Its Boundaries?,"Apple and Google have added useful features to texting apps, yet the apps still lack a major component: an effective way to set limits.",2022-09-14T09:00:25Z,https://www.nytimes.com/2022/09/14/technology/personaltech/texting-ios-android.html,Technology,The New York Times
A Law Used Against the Mafia — and Now Trump,Why the indictment in Georgia might be the hardest for the former president to escape.,2023-08-15T10:00:08Z,https://www.nytimes.com/2023/08/15/podcasts/the-daily/trump-indictment-georgia.html,Podcasts,The New York Times
Text Messaging Is Cool. But Where Are Its Boundaries?,"Apple and Google have added useful features to texting apps, yet the apps still lack a major component: an effective way to set limits.",2022-09-14T09:00:25Z,https://www.nytimes.com/2022/09/14/technology/personaltech/texting-ios-android.html,Technology,The New York Times
"The Retrievals, Season 1, Episode 3: The Sentence",From Serial Productions: The patients watch as the nurse who caused their pain is sentenced.,2023-07-13T10:00:09Z,https://www.nytimes.com/2023/07/13/podcasts/serial-the-retrievals-yale-fertility-clinic.html,Podcasts,The New York Times
Why a Coup in Niger Has the World’s Attention,"Neighboring countries have threatened to go to war — some to restore the elected president, and others to support the junta that ousted him.",2023-08-16T10:00:09Z,https://www.nytimes.com/2023/08/16/podcasts/the-daily/niger-coup.html,Podcasts,The New York Times
Tech Stocks Tumble as Growth Falters,"Disappointing earnings from Microsoft, Alphabet and Texas Instruments reveal the big challenges facing technology giants.",2022-10-26T12:04:51Z,https://www.nytimes.com/2022/10/26/business/dealbook/tech-stocks-microsoft-google-alphabet-meta-apple.html,Business,The New York Times
A Plot to Oust the House Speaker Hits Weary Investors,Matt Gaetz’s move to unseat Kevin McCarthy is adding volatility to equity and bond markets.,2023-10-03T11:56:27Z,https://www.nytimes.com/2023/10/03/business/dealbook/house-speaker-markets-gaetz-mccarthy.html,Business,The New York Times
Apple Starts Connecting the Dots for Its Next Big Thing,The company has enlisted Hollywood directors like Jon Favreau to help its effort to create products that blend the physical and virtual worlds.,2022-06-04T09:00:12Z,https://www.nytimes.com/2022/06/04/business/apple-virtual-reality-headset.html,Business,The New York Times
Eleanor Catton on ‘Birnam Wood’,"The New Zealand writer, who won the Man Booker Prize in 2013 for her novel “The Luminaries,” discusses her latest book.",2023-04-28T20:08:04Z,https://www.nytimes.com/2023/04/28/books/review/eleanor-catton-on-birnam-wood.html,Books,The New York Times
How to Tell if Your A.I. Is Conscious,"In a new report, scientists offer a list of measurable qualities that might indicate the presence of some presence in a machine.",2023-09-18T09:00:43Z,https://www.nytimes.com/2023/09/18/science/ai-computers-consciousness.html,Science,The New York Times
"An ‘Outstanding, Fast and Easy’ One-Pan Fish Dish","Lidey Heuck’s winning weeknight recipe by the numbers: one 9x13-inch pan, 30 minutes, five stars, 4,000 ratings.",2023-09-18T15:00:03Z,https://www.nytimes.com/2023/09/18/dining/an-outstanding-fast-and-easy-one-pan-fish-dish.html,Food,The New York Times
Don’t Take It From a ‘Thinkboi’,"You can do a lot of work for a long time and hope you are someday rewarded with success. Or you can skip the grueling, boring part and tweet as if you already are a success.",2023-06-30T09:00:01Z,https://www.nytimes.com/interactive/2023/06/30/business/what-is-a-thinkboi.html,Business,The New York Times
Trump’s Legal Jeopardy and America’s Political Crossroads,David French takes stock of the cases involving the ex-president and the challenges they present to the political system.,2023-03-28T09:00:32Z,https://www.nytimes.com/2023/03/28/opinion/ezra-klein-podcast-david-french.html,Opinion,The New York Times
The Inflation Story Has Changed Significantly. Paul Krugman Breaks It Down.,"The Nobel laureate economist discusses inflation’s slowdown, the G.O.P.’s incoherent economic agenda and A.I.’s impact on the labor market.",2023-02-17T10:00:22Z,https://www.nytimes.com/2023/02/17/opinion/ezra-klein-podcast-paul-krugman.html,Opinion,The New York Times
Sheet Cakes Are the Best Cakes (and These 11 Recipes Prove It),"They’re low fuss, feed a crowd and travel well.",2023-02-15T21:40:54Z,https://www.nytimes.com/article/best-sheet-cake-recipes.html,Food,The New York Times
‘Selena Gomez: My Mind and Me’ Review: An Honest Portrait of Stardom,"Sincere and soul-baring, the documentary, directed by Alek Keshishian, captures Gomez’s challenges with mental illness, lupus and fame.",2022-11-03T01:00:06Z,https://www.nytimes.com/2022/11/02/movies/selena-gomez-my-mind-and-me-review.html,Movies,The New York Times
The ‘Whisper Listing’ Gets Louder,Wealthy homeowners who want to avoid attention often try to sell their homes privately. But a tight housing market has led more agents to pursue this tactic.,2023-07-07T09:00:14Z,https://www.nytimes.com/interactive/2023/07/07/business/what-is-a-whisper-listing.html,Business,The New York Times
Montana Legislature Approves Outright Ban of TikTok,"The bill, which would make the state the first to ban the social media app, now goes to the desk of Gov. Greg Gianforte.",2023-04-14T21:40:56Z,https://www.nytimes.com/2023/04/14/technology/montana-tiktok-ban-passed.html,Technology,The New York Times
"Arepas, Cornell Chicken and Fresh and Wild Mushroom Stew","Some griddling, roasting and easy simmering for your weekend.",2023-10-27T12:00:02Z,https://www.nytimes.com/2023/10/27/dining/arepas-cornell-chicken-and-fresh-and-wild-mushroom-stew.html,Food,The New York Times
‘Jules’ Review: Close Encounters of the Lonely Kind,Ben Kingsley plays an elderly man struggling with a fading memory when an extraterrestrial crashes into his life.,2023-08-10T15:43:53Z,https://www.nytimes.com/2023/08/10/movies/jules-review.html,Movies,The New York Times
How the Birth Control Pill Got Over the Counter,The availability of the pill without a prescription could significantly expand access to contraception.,2023-07-19T10:00:21Z,https://www.nytimes.com/2023/07/19/podcasts/the-daily/birth-control-pill.html,Podcasts,The New York Times
How Taylor Swift Shapes the Story of Her Eras,"The pop superstar is back on tour for the first time since 2018, performing grand stadium shows that spin a narrative from her 10-album catalog.",2023-03-31T16:46:58Z,https://www.nytimes.com/2023/03/31/arts/music/popcast-taylor-swift-eras-tour.html,Arts,The New York Times
How Taylor Swift Shapes the Story of Her Eras,"The pop superstar is back on tour for the first time since 2018, performing grand stadium shows that spin a narrative from her 10-album catalog.",2023-03-31T16:46:58Z,https://www.nytimes.com/2023/03/31/arts/music/popcast-taylor-swift-eras-tour.html,Arts,The New York Times
A Major Overhaul of Prescription Drug Prices,A negotiation program is projected to save the government tens of billions of dollars in the coming years.,2023-08-31T10:00:14Z,https://www.nytimes.com/2023/08/31/podcasts/the-daily/medicare-price-negotiation.html,Podcasts,The New York Times
This Creamy Baked Mac and Cheese Is a Thanksgiving Must Have,"Before you ask: Yes, there’s Velveeta involved.",2023-11-21T18:00:03Z,https://www.nytimes.com/2023/11/21/dining/mac-and-cheese-thanksgiving.html,Food,The New York Times
"Samsung’s A.I. Moment Is Here, but Is It Ready?",Foreign investors betting on artificial intelligence are pouring money into the company’s shares. Analysts say it will have a hard time keeping up with rivals.,2023-07-04T04:00:09Z,https://www.nytimes.com/2023/07/04/technology/samsung-artificial-intelligence.html,Technology,The New York Times
Menopause Is Having a Moment,"Our writer explains why menopause has been misunderstood by both doctors and society, and what happened after she wrote about it.",2023-07-28T10:00:06Z,https://www.nytimes.com/2023/07/28/podcasts/the-daily/menopause-symptoms-treatment.html,Podcasts,The New York Times
"How Liberals — Yes, Liberals — Are Hobbling Government",The legal scholar Nicholas Bagley argues that the liberal “procedural fetish” makes it difficult for government to accomplish anything bold.,2023-02-07T10:00:17Z,https://www.nytimes.com/2023/02/07/opinion/ezra-klein-podcast-nicholas-bagley.html,Opinion,The New York Times
"In a Challenge to Beijing, Unrest Over Covid Lockdowns Spreads","Protests are rising as China enacts more lockdowns and quarantines, with no end in sight. The defiance is a test of Xi Jinping’s authoritarian leadership.",2022-11-24T11:39:29Z,https://www.nytimes.com/2022/11/24/world/asia/china-unrest-covid-lockdowns.html,World,The New York Times
How Well Do You Know the New York City of the Beats?,Here are five questions to test your knowledge of the Beat Generation in the Big Apple.,2022-12-02T14:00:54Z,https://www.nytimes.com/interactive/2022/12/02/books/review/new-york-beats-quiz.html,Books,The New York Times
The Friendship Harmonies of boygenius,"How Julien Baker, Phoebe Bridgers and Lucy Dacus’s side project has become a major part of their music — and their lore.",2023-04-06T19:29:48Z,https://www.nytimes.com/2023/04/06/arts/music/popcast-boygenius.html,Arts,The New York Times
Apple unveils new software to make the iPhone and other products feel new.,"The company, for the first time since the pandemic started, invited technologists and press to a kickoff for its annual developer conference at its Silicon Valley campus.",2022-06-06T18:00:25Z,https://www.nytimes.com/2022/06/06/business/apple-ios-16-software-updates.html,Business,The New York Times
Summer Book Preview and 9 Thrillers to Read,"Gilbert Cruz is joined by The Times’s thriller columnist, Sarah Lyall, to talk about some great suspenseful titles to check out this summer. And the editor Joumana Khatib gives her picks for books to look out for between now and Labor Day.",2023-06-09T19:53:21Z,https://www.nytimes.com/2023/06/09/books/review/summer-book-preview-and-9-thrillers-to-read.html,Books,The New York Times
What Lahaina Lost in Hawaii’s Wildfires,"The fires that swept through Hawaii’s former royal capital devastated its historic center, including a 200-year-old church. Its minister explains what it means to lose the town.",2023-08-14T10:00:13Z,https://www.nytimes.com/2023/08/14/podcasts/the-daily/hawaii-wildfires.html,Podcasts,The New York Times
Voices From Gaza,"As hundreds of thousands flee south from northern Gaza, we hear from two people caught in the chaos.",2023-10-16T10:00:09Z,https://www.nytimes.com/2023/10/16/podcasts/the-daily/gaza-israel.html,Podcasts,The New York Times
Israel and Hamas’s Fragile Cease-Fire,How a grass-roots campaign for the return of hostages managed to pause the war in Gaza.,2023-11-28T11:00:10Z,https://www.nytimes.com/2023/11/28/podcasts/the-daily/israel-hamas-ceasefire.html,Podcasts,The New York Times
Twitter Keeps Missing Its Advertising Targets as Woes Mount,"Under Elon Musk, the company has cut its financial expectations as some advertisers request discounts and are offered incentives.",2022-12-02T23:53:13Z,https://www.nytimes.com/2022/12/02/technology/twitter-advertising-targets-missed.html,Technology,The New York Times
How Clarence Thomas Came to Reject Affirmative Action,The Supreme Court justice has long been among the most ardent critics of the policy.,2023-07-14T10:00:16Z,https://www.nytimes.com/2023/07/14/podcasts/the-daily/clarence-thomas-affirmative-action-scotus.html,Podcasts,The New York Times
