title,snippet,pub_date,web_url,section,source
How Young Is Too Young for an Apple Watch?,Do smart watches work as training wheels for a smartphone? Or do they just hook children on technology at an even earlier age?,2022-10-21T09:00:07Z,https://www.nytimes.com/2022/10/21/learning/how-young-is-too-young-for-an-apple-watch.html,The Learning Network,The New York Times
"Easy to Use, Mobile Payment Apps Are Also Easy to Misuse","While they have taken steps to help prevent mishaps, a new report finds they offer few protections if, for instance, users accidentally send money to the wrong person.",2023-01-28T08:00:08Z,https://www.nytimes.com/2023/01/28/your-money/mobile-payment-venmo-zelle-cash-app.html,Your Money,The New York Times
Streaming’s Golden Age Is Suddenly Dimming,"After years of breakneck growth, the number of scripted TV series orders made by networks and streamers is in decline.",2022-12-18T21:38:48Z,https://www.nytimes.com/2022/12/18/business/media/streaming-tv-shows-canceled.html,Business,The New York Times
Want to Watch the Yankees on Friday? There’s an App for That.,A game between the Yankees and the Boston Red Sox in which Aaron Judge could be gunning for his 62nd home run will be broadcast only on Apple TV+.,2022-09-22T21:56:22Z,https://www.nytimes.com/2022/09/22/sports/baseball/aaron-judge-yankees-apple-tv.html,Sports,The New York Times
"Corrections: Sept. 8, 2023","Corrections that appeared in print on Friday, Sept. 8, 2023.",2023-09-08T04:00:18Z,https://www.nytimes.com/2023/09/08/pageoneplus/corrections-sept-8-2023.html,Corrections,The New York Times
An Apple Watch for Your 5-Year-Old? More Parents Say Yes.,"As Apple prepares to unveil new models next week, the smart watch has found an unexpected audience: children as young as 5.",2022-09-01T09:01:01Z,https://www.nytimes.com/2022/09/01/technology/apple-watch-children-kids.html,Technology,The New York Times
Boucheron’s Idea of High Jewelry: A Gem for Your Hoodie,"The new collection, More is More, includes a diamond and onyx pocket and a jeweled scrunchie.",2023-07-02T19:08:06Z,https://www.nytimes.com/2023/07/02/fashion/high-jewelry-boucheron-claire-choisne.html,Fashion,International New York Times
"‘Fingernails’ Review: Love, Factually",Jessie Buckley and Riz Ahmed play confused lonely-hearts torn between science and emotion in this adorable near-future romance.,2023-11-02T11:00:21Z,https://www.nytimes.com/2023/11/02/movies/fingernails-review-love-factually.html,Movies,The New York Times
Coconut Saag is as Soothing as It Sounds,It’s quite possibly the most luxurious way to eat a pound of leafy greens.,2023-10-11T15:00:04Z,https://www.nytimes.com/2023/10/11/dining/coconut-saag.html,Food,The New York Times
"‘New York, New York’ Review: The Big Apple, Without Bite","Based loosely on the 1977 film, a show about performers making it in the big city comes to St. James Theater with the sharper edges of its source material sanded off.",2023-04-27T02:00:07Z,https://www.nytimes.com/2023/04/26/theater/new-york-new-york-review-broadway.html,Theater,The New York Times
Two Lawyers Rank the Severity of Trump’s Many Indictments,Everything you need to know about the former president’s legal cases.,2023-09-26T09:01:38Z,https://www.nytimes.com/2023/09/26/opinion/ezra-klein-podcast-ken-white.html,Opinion,The New York Times
It’s Time to Talk About ‘Pandemic Revisionism’,"The epidemiologist Katelyn Jetelina takes stock of school closures, mask mandates and the pandemic response.",2023-08-29T09:00:03Z,https://www.nytimes.com/2023/08/29/opinion/ezra-klein-podcast-katelyn-jetelina.html,Opinion,The New York Times
‘Still: A Michael J. Fox Movie’ Review: Hiding in Plain Sight,"The “Back to the Future” star time-travels through his career in this documentary, charting his experiences learning to live with Parkinson’s disease.",2023-05-11T11:00:09Z,https://www.nytimes.com/2023/05/11/movies/still-a-michael-j-fox-movie-review-hiding-in-plain-sight.html,Movies,The New York Times
Popcast (Deluxe): Is the Pop Music Machine Stuck in Place?,"With certain headliners hogging up space, where are the new stars? We checked in on recent hits from the radio, streaming services and TikTok.",2023-11-01T19:24:27Z,https://www.nytimes.com/2023/11/01/arts/music/popcast-deluxe-is-the-pop-music-machine-stuck-in-place.html,Arts,The New York Times
Barbara Kingsolver Thinks Urban Liberals Have It All Wrong on Appalachia,The Pulitzer Prize-winning author Barbara Kingsolver talks about writing “the great Appalachian novel.”,2023-07-21T09:00:06Z,https://www.nytimes.com/2023/07/21/opinion/ezra-klein-podcast-barbara-kingsolver.html,Opinion,The New York Times
X May Lose Up to $75 Million in Revenue as More Advertisers Pull Out,"Internal documents show companies like Airbnb, Coca-Cola and Microsoft have halted ads, or may do so, after Elon Musk’s endorsement of an antisemitic conspiracy theory.",2023-11-24T22:00:51Z,https://www.nytimes.com/2023/11/24/business/x-elon-musk-advertisers.html,Business,The New York Times
Visiting New York? Make Sure A.I. Didn’t Write Your Guidebook.,Some guides near the top of Amazon search results don’t appear to have been written by a human being.,2023-09-14T04:02:05Z,https://www.nytimes.com/2023/09/14/us/new-york-guidebooks-artificial-intelligence.html,U.S.,The New York Times
Israel Is Giving Hamas What It Wants,Lessons for Israel from the American response to Sept. 11.,2023-10-18T09:03:47Z,https://www.nytimes.com/2023/10/18/opinion/ezra-klein-podcast-israel-palestine.html,Opinion,The New York Times
A Plan to Ban TikTok in Montana Is a Preview for the Rest of the Country,The fight has shown the difficult test and legally perilous road facing lawmakers or the White House if they try to enact a national ban on the social media service.,2023-04-12T14:23:01Z,https://www.nytimes.com/2023/04/12/technology/tiktok-ban-montana.html,Technology,The New York Times
How ‘Being Animal’ Could Help Us Be Better Humans,The environmental philosopher Melanie Challenger blurs the line long drawn between humans and animals.,2023-06-27T09:00:32Z,https://www.nytimes.com/2023/06/27/opinion/ezra-klein-podcast-melanie-challenger.html,Opinion,The New York Times
"Psychedelic Therapy, Threads vs. Twitter, My New Book and More",Ezra Klein answers listeners’ questions.,2023-07-25T09:00:10Z,https://www.nytimes.com/2023/07/25/opinion/ezra-klein-podcast-ask-me-anything.html,Opinion,The New York Times
Will Smith Film ‘Emancipation’ Will Be Released in December,"Apple said the movie, Mr. Smith’s first since his infamous slap at the Oscars, will be in theaters on Dec. 2 and begin streaming on Dec. 9.",2022-10-03T16:55:03Z,https://www.nytimes.com/2022/10/03/business/media/will-smith-emancipation-release-date.html,Business,The New York Times
"The Run-Up Returns, Every Week Through Election Day",It could be 2020 all over again. That’s what makes 2024 so different.,2023-10-30T09:02:08Z,https://www.nytimes.com/2023/10/30/podcasts/the-run-up-returns-every-week-through-election-day.html,Podcasts,The New York Times
Thanksgiving Puzzle Answers 2023,See the answers for “Two Truths and a Pie” and our dessert-themed crossword,2023-11-20T10:02:05Z,https://www.nytimes.com/2023/11/20/crosswords/thanksgiving-puzzle-answers.html,Gameplay,The New York Times
We Need Better Narratives About Gender,Masha Gessen and Lydia Polgreen reflect on the backlash — both legislative and cultural — against L.G.B.T.Q. rights and what it means to understand queer life more expansively.,2023-10-10T09:00:50Z,https://www.nytimes.com/2023/10/10/opinion/ezra-klein-podcast-masha-gessen-oct-2023.html,Opinion,The New York Times
"In ‘City on Fire,’ the New York of the Early 2000s Burns Bright",A new TV adaptation of the celebrated novel moves the story from the 1970s to the post-9/11 era.,2023-05-04T09:00:35Z,https://www.nytimes.com/2023/05/04/arts/television/city-on-fire.html,Arts,The New York Times
"In ‘City on Fire,’ the New York of the Early 2000s Burns Bright",A new TV adaptation of the celebrated novel moves the story from the 1970s to the post-9/11 era.,2023-05-04T09:00:35Z,https://www.nytimes.com/2023/05/04/arts/television/city-on-fire.html,Arts,The New York Times
How Much Would You Pay for Steve Jobs’s Birkenstocks?,"At a recent event for the brand, we asked partygoers what they would give for the Apple co-founder’s sandals.",2022-12-05T10:00:20Z,https://www.nytimes.com/2022/12/05/style/birkenstocks.html,Style,The New York Times
Me Walk Pretty One Day,"Nothing gets between the humorist David Sedaris and his 21,000 daily steps.",2023-06-30T09:00:20Z,https://www.nytimes.com/2023/06/30/well/david-sedaris-walking.html,Well,The New York Times
Montana Governor Signs Total Ban of TikTok in the State,The legislation is the most extreme prohibition of the app in the nation and will almost certainly face legal challenges.,2023-05-17T22:17:57Z,https://www.nytimes.com/2023/05/17/business/montana-tiktok-ban.html,Business,The New York Times
The Success of Rebecca Yarros and Barbra Streisand’s Mammoth Memoir,Alexandra Alter talks about her profile of the best-selling author behind “Fourth Wing” and Alexandra Jacobs discusses her review of “My Name is Barbra.”,2023-11-10T18:47:37Z,https://www.nytimes.com/2023/11/10/books/review/podcast-rebecca-yarros-fourth-wing.html,Books,The New York Times
(Yet Another) Emergency Pod: Sam Altman Is Back,"Fired, then hired to the same post.",2023-11-23T00:06:03Z,https://www.nytimes.com/2023/11/22/podcasts/hard-fork-altman-openai-rehired.html,Podcasts,The New York Times
"Corrections: April 20, 2023","Corrections that appeared in print on Thursday, April 20, 2023.",2023-04-20T02:26:27Z,https://www.nytimes.com/2023/04/19/pageoneplus/corrections-april-20-2023.html,Corrections,The New York Times
"Who Is Madonna, Anyway?","A conversation with the biographer Mary Gabriel, whose substantial new book offers a comprehensive and surprising look at the pop star’s life and career.",2023-10-06T16:36:51Z,https://www.nytimes.com/2023/10/06/books/review/who-is-madonna-anyway.html,Books,The New York Times
Thursday Briefing: The First Evacuees Leave Gaza,Plus four days of Halloween in Shanghai.,2023-11-01T21:11:17Z,https://www.nytimes.com/2023/11/01/briefing/gaza-india-dalio.html,Briefing,The New York Times
Google Allows More App Payment Options in Antitrust Deal With States,The tech giant will pay $700 million and allow app makers to collect payments directly from consumers in a settlement it hopes will help resolve other legal challenges.,2023-12-19T04:34:23Z,https://www.nytimes.com/2023/12/18/technology/google-app-payment-antitrust-settlement.html,Technology,The New York Times
Bingeing in Comfort This Summer,"Dinner and a show — that is, eating in front of the TV — only gets easier with the right furniture and a can-do attitude.",2023-06-26T09:01:37Z,https://www.nytimes.com/2023/06/26/realestate/living-room-tv-dining.html,Real Estate,The New York Times
The New Stakes in Pay-TV Battles to Come,"Disney’s deal with Charter will give it more streaming customers, but it also reflects concessions that other content providers will have to make in the future.",2023-09-12T12:13:40Z,https://www.nytimes.com/2023/09/12/business/dealbook/disney-charter-pay-tv.html,Business,The New York Times
Tech Companies Slowly Shift Production Away From China,"Worried about geopolitical tensions and stung by pandemic shutdowns, Google, Apple and others are moving some work to nearby countries.",2022-09-01T09:01:10Z,https://www.nytimes.com/2022/09/01/business/tech-companies-china.html,Business,The New York Times
"Popcast (Deluxe): Mailbag! The Beatles, Taylor Swift and More",Taking viewer and listener questions on hot topics in pop music.,2023-11-22T19:35:24Z,https://www.nytimes.com/2023/11/22/arts/music/beatles-mailbag-popcast-deluxe.html,Arts,The New York Times
"Israel Struck a Dense Area in Gaza, Saying It Killed Hamas Militants","Also, the new speaker sets up a clash over military aid. Here’s the latest at the end of Tuesday.",2023-10-31T21:50:21Z,https://www.nytimes.com/2023/10/31/briefing/israel-hamas-war-mike-johnson-military-aid.html,Briefing,The New York Times
Do We Need Album Reviews Anymore?,A conversation about the history — and future — of album reviews in an increasingly fraught environment for music journalism and criticism.,2023-10-12T18:54:52Z,https://www.nytimes.com/2023/10/12/arts/music/popcast-album-reviews.html,Arts,The New York Times
"Hollywood’s Latest Cliffhanger, Explained","In an interview, John Koblin, who covers the television industry for The New York Times, discussed the ongoing writers’ strike.",2023-05-10T07:00:12Z,https://www.nytimes.com/2023/05/10/insider/wga-writers-strike-explained.html,Times Insider,The New York Times
What the Biden-Xi Talks Accomplished (and Didn't),Wednesday’s four-hour meeting in San Francisco resulted in few breakthroughs. But C.E.O.s gave the Chinese leader a standing ovation at a banquet afterward.,2023-11-16T13:18:27Z,https://www.nytimes.com/2023/11/16/business/dealbook/biden-xi-talks-san-francisco.html,Business,The New York Times
How to Tell the Story of a Giant Wildfire,"John Vaillant, the author of “Fire Weather” (one of our 10 Best Books this year), discusses climate change and the fire that devastated a Canadian petroleum town in 2016.",2023-12-15T18:58:21Z,https://www.nytimes.com/2023/12/15/books/review/how-to-tell-the-story-of-a-giant-wildfire.html,Books,The New York Times
"It’s Simple: Fewer Watches, Higher Prices","“Let’s face the reality,” one executive said, “this is a trend in the luxury business. And we are part of that business.”",2023-07-23T09:04:17Z,https://www.nytimes.com/2023/07/23/fashion/watches-production-prices-switzerland.html,Fashion,International New York Times
"It’s Simple: Fewer Watches, Higher Prices","“Let’s face the reality,” one executive said, “this is a trend in the luxury business. And we are part of that business.”",2023-07-23T09:04:17Z,https://www.nytimes.com/2023/07/23/fashion/watches-production-prices-switzerland.html,Fashion,International New York Times
The Case Against (Some) Buybacks,"Not in every instance, but in this one.",2023-03-06T18:00:04Z,https://www.nytimes.com/2023/03/06/opinion/buybacks-chips-act-buffett.html,Opinion,The New York Times
One of the Last Bastions of Digital Privacy Is Under Threat,There are dangers to the latest regulatory efforts to force tech companies to monitor all content before it gets encrypted.,2023-06-13T09:01:00Z,https://www.nytimes.com/2023/06/13/opinion/encryption-messaging-privacy-signal-whatsapp.html,Opinion,The New York Times
What Tom Hanks Thinks of America,"The decorated actor discusses his new novel, the magic of typewriters and his read of the American psyche.",2023-07-14T09:00:08Z,https://www.nytimes.com/2023/07/14/opinion/ezra-klein-podcast-tom-hanks.html,Opinion,The New York Times
Popcast (Deluxe): Drake’s New Album Courts New Enemies,"A discussion about “For All the Dogs” and the fever-pitch online discourse around Drake, his career and his public persona. Plus: reality TV drama.",2023-10-11T14:50:42Z,https://www.nytimes.com/2023/10/11/arts/music/drake-for-all-the-dogs-popcast.html,Arts,The New York Times
Popcast (Deluxe): Taylor Swift’s Eras Tour Movie + Bad Bunny Returns,A conversation about Swift’s concert film documenting her summer stadium sojourn. Plus: The new album “Nadie Sabe Lo Que Va a Pasar Mañana.”,2023-10-18T15:45:24Z,https://www.nytimes.com/2023/10/18/arts/music/taylor-swift-movie-bad-bunny-popcast.html,Arts,The New York Times
"On TikTok, Gen Z Beatles Fans Share Thoughts on ‘Now and Then’","“Can’t believe it’s 2023 and I get the joy of hearing a new Beatles song for the first time ever,” a 23-year-old says in a video post.",2023-11-03T09:03:26Z,https://www.nytimes.com/2023/11/03/style/beatles-fans-now-and-then-reaction.html,Style,The New York Times
Help! My Boss Won’t Stop Using ChatGPT,Kevin and Casey answer your questions.,2023-07-14T09:00:06Z,https://www.nytimes.com/2023/07/14/podcasts/hard-fork-mailbag.html,Podcasts,The New York Times
Epic Games C.E.O. Says Google Has ‘De Facto Control’ on Android App,"Tim Sweeney, who runs the company that created Fortnite, testified in a case that, if he wins, could allow competing payment systems on the Play Store.",2023-11-20T23:55:59Z,https://www.nytimes.com/2023/11/20/technology/epic-games-google-lawsuit-sweeney.html,Technology,The New York Times
Popcast (Deluxe): Doja Cat’s Rap Renaissance + Taylor Swift & Travis Kelce,"Breaking down Doja Cat’s surprising new album, “Scarlet,” plus: Swift’s foray into football and Hasan Minhaj’s fibs.",2023-09-27T14:39:16Z,https://www.nytimes.com/2023/09/27/arts/music/popcast-deluxe-doja-cat-taylor-swift-travis-kelce.html,Arts,The New York Times
Popcast (Deluxe): Doja Cat’s Rap Renaissance + Taylor Swift & Travis Kelce,"Breaking down Doja Cat’s surprising new album, “Scarlet,” plus: Swift’s foray into football and Hasan Minhaj’s fibs.",2023-09-27T14:39:16Z,https://www.nytimes.com/2023/09/27/arts/music/popcast-deluxe-doja-cat-taylor-swift-travis-kelce.html,Arts,The New York Times
5 Things to Do This Weekend,"Selections from the Weekend section, including a review of ""The Wanderers,"" starring Katie Holmes.",2023-02-17T10:00:02Z,https://www.nytimes.com/interactive/2023/02/17/arts/weekend-editors-picks-the-wanderers-play.html,Arts,The New York Times
What’s Driving the September Stock Swoon,"The S&P 500 is trading at a three-month low as surging oil prices, rising bond yields and concerns about economic growth send investors to the exits.",2023-09-28T11:45:54Z,https://www.nytimes.com/2023/09/28/business/dealbook/september-stock-swoon.html,Business,The New York Times
HBO’s ‘Succession’ Dominates Emmy Nominations in Uncertain Year,"Its final season earned 27 nods, the most of any drama, while “Ted Lasso” got 21, the most of any comedy. But the writers’ strike could delay the ceremony, planned for September.",2023-07-12T21:37:39Z,https://www.nytimes.com/2023/07/12/arts/emmy-nominations-hbo-succession.html,Arts,The New York Times
"As U.S. and Chinese Officials Meet, Businesses Temper Their Hopes",Chief executives in the U.S. have long pushed for closer ties between the two countries. Now they just hope a rocky situation won’t get worse.,2023-06-17T09:00:36Z,https://www.nytimes.com/2023/06/17/business/economy/china-united-states-business.html,Business,The New York Times
What Communes and Other Radical Experiments in Living Together Reveal,Intentional communities may offer solutions for loneliness and other problems of an atomized society.,2023-06-09T09:00:18Z,https://www.nytimes.com/2023/06/09/opinion/ezra-klein-kristen-ghodsee.html,Opinion,The New York Times
Popcast (Deluxe): What Is Going on With the Grammy Nominations?,"Dissecting the contenders for the 2024 Grammy Awards, including top nods for SZA, Olivia Rodrigo, boygenius, Miley Cyrus, Taylor Swift and Jon Batiste.",2023-11-16T13:59:44Z,https://www.nytimes.com/2023/11/16/arts/music/grammy-nominations-popcast.html,Arts,The New York Times
What to Expect at Today’s DealBook Summit,"Vice President Kamala Harris, Elon Musk, Bob Iger, Jamie Dimon and Tsai Ing-wen, the president of Taiwan, are among the big names speaking.",2023-11-29T12:03:17Z,https://www.nytimes.com/2023/11/29/business/dealbook/dealbook-summit-harris-musk.html,Business,The New York Times
A.I. Could Solve Some of Humanity’s Hardest Problems. It Already Has.,"Demis Hassabis, the chief executive of DeepMind, discusses how A.I. systems can accelerate scientific research.",2023-07-11T09:00:28Z,https://www.nytimes.com/2023/07/11/opinion/ezra-klein-podcast-demis-hassabis.html,Opinion,The New York Times
Drake Takes on All Comers,"The rapper’s new album, “For All the Dogs,” has stirred debate about maturity and misogyny, and led to questions about the next phase of his career.",2023-10-20T16:41:08Z,https://www.nytimes.com/2023/10/20/arts/music/popcast-drake-for-all-the-dogs.html,Arts,The New York Times
A Conservative on How His Party Has Changed Since 2016,Ben Domenech tours the various factions of the Republican Party.,2023-08-08T09:00:10Z,https://www.nytimes.com/2023/08/08/opinion/ezra-klein-podcast-ben-domenech.html,Opinion,The New York Times
PacWest’s Stock Plunge Reignites Banking Sector Fears,"The regional lender said it is weighing its options, after its shares fell despite assertions by the Federal Reserve that the recent bank crisis is contained.",2023-05-04T12:04:43Z,https://www.nytimes.com/2023/05/04/business/dealbook/pacwest-deal-fed.html,Business,The New York Times
The I.R.A. Passed a Year Ago. Here’s a Progress Check.,Robinson Meyer offers a progress check on the Inflation Reduction Act and America’s path toward lower emissions.,2023-07-07T09:00:10Z,https://www.nytimes.com/2023/07/07/opinion/ezra-klein-podcast-robinson-meyer.html,Opinion,The New York Times
"It’s not illegal to be a monopoly, but it is illegal for one to misuse its market power.",,2023-09-12T14:41:52Z,https://www.nytimes.com/live/2023/09/12/business/google-antitrust-trial/its-not-illegal-to-be-a-monopoly-but-it-is-illegal-for-one-to-misuse-its-market-power,Business,The New York Times
"Why This Economist Wants to Give Every Poor Child $50,000",The economist Darrick Hamilton discusses how policy proposals like “baby bonds” could help the country move toward greater racial and economic equity.,2023-06-23T09:00:36Z,https://www.nytimes.com/2023/06/23/opinion/ezra-klein-podcast-darrick-hamilton.html,Opinion,The New York Times
Google Goes on Trial Over Justice Dept. Claims That It Has Monopoly Power,"The government claims that Google illegally stifles rivals, while the company says its practices are legal and mainstream.",2023-09-11T09:01:01Z,https://www.nytimes.com/2023/09/11/technology/google-monopoly-justice-dept-trial.html,Technology,The New York Times
Perfect Roasted Broccoli,"Lidey Heuck’s new recipe is simplicity itself, with just a little minced garlic tossed in during the last two minutes of cooking so it doesn’t burn.",2023-10-18T15:00:03Z,https://www.nytimes.com/2023/10/18/dining/perfect-roasted-broccoli.html,Food,The New York Times
What We Learned From the Deepest Look at Homelessness in Decades,"Researchers in California administered nearly 3,200 questionnaires and conducted 365 in-depth interviews. Their findings reveal a lot about housing policy.",2023-07-18T09:00:13Z,https://www.nytimes.com/2023/07/18/opinion/ezra-klein-podcast-jerusalem-demsas.html,Opinion,The New York Times
Caramel Apple Pie Cake for the Best of Both Worlds,"Try the dessert from Ovenly in Greenpoint, Brooklyn, read a history of accidental culinary discoveries, and more.",2022-10-31T17:29:09Z,https://www.nytimes.com/2022/10/31/dining/caramel-apple-pie-cake-ovenly.html,Food,The New York Times
Searching for the ‘People’s Spelling Alphabet’,The NATO alphabet is an international standard of communication. That doesn’t stop people from saying “N as in Nancy.”,2023-08-28T16:01:23Z,https://www.nytimes.com/2023/08/28/crosswords/searching-for-the-peoples-spelling-alphabet.html,Gameplay,The New York Times
U.S. v. Google,The government has set its sights on the internet behemoth in the first monopoly trial of the modern internet era.,2023-09-11T10:00:10Z,https://www.nytimes.com/2023/09/11/podcasts/the-daily/google-monopoly-trial.html,Podcasts,The New York Times
Popcast (Deluxe): ‘Priscilla’ and ‘The Golden Bachelor’ Plumb Heartbreak,"A conversation about Sofia Coppola’s impressionistic take on Elvis and Priscilla Presley’s relationship, plus: the surprising depth of a reality TV spinoff.",2023-11-08T17:53:59Z,https://www.nytimes.com/2023/11/08/arts/music/priscilla-golden-bachelor-popcast-deluxe.html,Arts,The New York Times
Stream These 6 Great Norman Lear Shows,"Beginning with “All in the Family,” Lear filled the airwaves throughout the 1970s with popular, critically acclaimed shows about families from varied ethnic and economic backgrounds.",2023-12-06T14:00:47Z,https://www.nytimes.com/2023/12/06/arts/television/norman-lear-tv-shows-streaming.html,Arts,The New York Times
Noam Chomsky: The False Promise of ChatGPT,The most prominent strain of A.I. encodes a flawed conception of language and knowledge.,2023-03-08T10:00:25Z,https://www.nytimes.com/2023/03/08/opinion/noam-chomsky-chatgpt-ai.html,Opinion,The New York Times
Shakespeare’s First Folio Turns 400,"Sarah Lyall talks to Adrian Edwards, head of the Printed Heritage Collections at the British Library, about the 400th anniversary of Shakespeare’s First Folio.",2023-11-03T15:56:33Z,https://www.nytimes.com/2023/11/03/books/review/shakespeares-first-folio-turns-400.html,Books,The New York Times
Jelly Roll: The Popcast (Deluxe) Interview,An emotional conversation with one of the year’s biggest breakout stars about turning his life around and transitioning from Southern rap to country hitmaking.,2023-12-13T20:05:27Z,https://www.nytimes.com/2023/12/13/arts/music/jelly-roll-popcast-deluxe-interview.html,Arts,The New York Times
"What’s Next for OpenAI, Binance Is Binanceled and A.I. Is Eating the Internet","It’s full steam ahead for the tech world despite, well, everything.",2023-12-01T10:03:32Z,https://www.nytimes.com/2023/12/01/podcasts/hard-fork-openai-future-binance.html,Podcasts,The New York Times
How Is Your Company Responding to Labor Organizing? We Want to Hear.,Employers are taking a variety of approaches to union campaigns.,2022-10-26T17:20:59Z,https://www.nytimes.com/2022/10/26/business/labor-management-callout.html,Business,The New York Times
