title,snippet,pub_date,web_url,section,source
A Playlist That’s as Cool as Kim Deal,"Hear tracks from her first solo album, the Breeders, Pixies and more.",2024-11-22T19:00:02Z,https://www.nytimes.com/2024/11/22/arts/music/amplifier-newsletter-kim-deal.html,Arts,The New York Times
Digging Into Kendrick Lamar’s Samples,"Listen to some of the most notable sonic references on “GNX,” from SWV, Luther Vandross and Debbie Deb.",2024-11-26T19:01:00Z,https://www.nytimes.com/2024/11/26/arts/music/amplifier-newsletter-kendrick-lamar-samples.html,Arts,The New York Times
5 Things to Do This Weekend,"A selection of entertainment highlights this weekend, including screenings of “The Texas Chain Saw Massacre,” which soon turns 50.",2024-08-09T09:04:54Z,https://www.nytimes.com/interactive/2024/08/09/arts/weekend-editors-picks-texas-chainsaw-massacre.html,Arts,The New York Times
A Bizarre Love Triangle Playlist,"Sabrina Carpenter, Loretta Lynn and SZA sing about all the points on a love triangle.",2024-11-19T19:00:04Z,https://www.nytimes.com/2024/11/19/arts/music/amplifier-newsletter-love-triangles-sabrina-carpenter.html,Arts,The New York Times
8 Correct Answers to ‘What Was the Song of the Summer?’,"Revisit contenders from Sabrina Carpenter, Kendrick Lamar and Billie Eilish.",2024-08-23T18:00:09Z,https://www.nytimes.com/2024/08/23/arts/music/amplifier-newsletter-sabrina-carpenter-espresso.html,Arts,The New York Times
The 15 Songs That Hit No. 1 This Year (So Far),"Hear tracks by Shaboozey, Sabrina Carpenter, Kendrick Lamar and more.",2024-07-09T18:00:06Z,https://www.nytimes.com/2024/07/09/arts/music/amplifier-newsletter-no-1-songs-2024.html,Arts,The New York Times
Can Movies for Grown-Ups Still Sell Tickets? ‘Fly Me to the Moon’ Is a Test.,"Directed by Greg Berlanti, the film amounts to a Hollywood experiment: Is there still room at the multiplexes for original movies aimed at grown-ups.",2024-07-11T15:47:09Z,https://www.nytimes.com/2024/07/11/business/media/fly-me-to-the-moon-greg-berlanti.html,Business,The New York Times
What to Watch This Weekend: A Supernatural Dramedy,“The Big Door Prize” returns for another season of charming small-town folks grappling with their fates.,2024-05-02T16:41:01Z,https://www.nytimes.com/2024/05/02/arts/television/big-door-prize.html,Arts,The New York Times
Ka Made Rap on His Own Terms. Hear How in 7 Songs.,"Remembering the hip-hop artist (and New York City firefighter), who died over the weekend at 52.",2024-10-15T18:00:02Z,https://www.nytimes.com/2024/10/15/arts/music/amplifier-newsletter-ka-playlist.html,Arts,The New York Times
What Wall Street Wants to Hear at the Debate,"Taxes, tariffs, trade and regulation: Business leaders have a long list of topics they want addressed in Tuesday’s presidential showdown.",2024-09-10T11:41:24Z,https://www.nytimes.com/2024/09/10/business/dealbook/presidential-debate-economy-wall-street.html,Business,The New York Times
10 Unforgettable Kris Kristofferson Covers,"Many of his songs are better known by other singers’ interpretations, like Janis Joplin’s “Me and Bobby McGee,” Johnny Cash’s “Sunday Morning Coming Down” and more.",2024-10-04T18:00:02Z,https://www.nytimes.com/2024/10/04/arts/music/amplifier-newsletter-kris-kristofferson-covers.html,Arts,The New York Times
"On Trial at 77, Hong Kong Media Mogul Denies Conspiring With U.S.","Jimmy Lai, who is charged with national security offenses, testified that his newspaper “carried a torch to the reality” of people’s desire for freedom in the city.",2024-11-20T04:31:58Z,https://www.nytimes.com/2024/11/19/world/asia/jimmy-lai-hong-kong-trial.html,World,The New York Times
Is It Too Late Now to Say Sorry? 8 Songs for the High Holy Days.,"Apology, forgiveness, moving on: These are some of humanity’s richest themes, and they have rich songs to match.",2024-10-08T18:00:08Z,https://www.nytimes.com/2024/10/08/arts/music/amplifier-newsletter-high-holy-days-playlist.html,Arts,The New York Times
Two Horror Authors on the Scary Books You Should Read,Stephen Graham Jones and Joe Hill with their recommendations for this Halloween season.,2024-10-29T17:15:51Z,https://www.nytimes.com/2024/10/29/books/review/joe-hill-stephen-graham-jones-horror-recommendations.html,Books,The New York Times
‘Founder Mode’ Explains the Rise of Trump in Silicon Valley,A trendy management style called “founder mode” illustrates Silicon Valley’s growing tilt toward authoritarianism.,2024-10-11T09:02:02Z,https://www.nytimes.com/2024/10/11/opinion/silicon-valley-musk-trump-andreessen.html,Opinion,The New York Times
Tech Bosses Preach Patience as They Spend and Spend on A.I.,"Big technology companies show no signs of slowing their spending on artificial intelligence, even though a payoff still looks a long way away.",2024-08-02T19:02:50Z,https://www.nytimes.com/2024/08/02/technology/tech-companies-ai-spending.html,Technology,The New York Times
5 Things to Do This Weekend,"A selection of entertainment highlights this weekend, including “The Old Man,” “How to Die Alone” and other TV picks for fall.",2024-09-13T09:04:00Z,https://www.nytimes.com/interactive/2024/09/13/arts/weekend-editors-picks-fall-TV-preview.html,Arts,The New York Times
New Music for Your Weekend,"Becky G, Willow, and a rare duet with Fiona Apple.",2024-03-22T09:06:13Z,https://www.nytimes.com/2024/03/22/podcasts/culture-desk-new-music-mixtape.html,Podcasts,The New York Times
7 Deep Cuts From the 2025 Grammy Nominations,"Big names dominate the biggest categories, but lovely discoveries await on the ballot too. Hear tracks from Arooj Aftab, Sierra Ferrell, Tems, Idles and more.",2024-11-08T19:00:03Z,https://www.nytimes.com/2024/11/08/arts/music/amplifier-newsletter-grammy-nominations.html,Arts,The New York Times
A Musical Tour of Tim Walz’s Minnesota,"The state is a hotbed of corrosive underground rock, birthplace of two acclaimed icons, home to a lively hip-hop scene and a bedrock of ’80s pop and funk.",2024-08-09T18:00:03Z,https://www.nytimes.com/2024/08/09/arts/music/amplifier-newsletter-minnesota-music.html,Arts,The New York Times
10 Standout R.E.M. Deep Cuts,Hear a pick from each of the band’s first 10 albums.,2024-06-21T18:00:06Z,https://www.nytimes.com/2024/06/21/arts/music/amplifier-newsletter-rem-deep-cuts.html,Arts,The New York Times
5 Things to Do This Weekend,"A selection of entertainment highlights this weekend, including the season finale of “House of the Dragon.”",2024-08-02T09:05:18Z,https://www.nytimes.com/interactive/2024/08/02/arts/weekend-editors-picks-house-of-the-dragon.html,Arts,The New York Times
Untitled (The Playlist),"Hear songs with no firm names from the Cure, D’Angelo, Kate Bollinger and more.",2024-08-02T18:00:04Z,https://www.nytimes.com/2024/08/02/arts/music/amplifier-newsletter-untitled-songs.html,Arts,The New York Times
"As Election Day nears, yard signs disappear.",,2024-11-04T23:30:02Z,https://www.nytimes.com/live/2024/11/04/us/harris-trump-election/as-election-day-nears-yard-signs-disappear,U.S.,The New York Times
‘Presumed Innocent’ Review: Disorder in the Court,"Jake Gyllenhaal steps in for Harrison Ford in a new, highly strung adaptation of Scott Turow’s legal thriller for Apple TV+.",2024-06-11T17:00:03Z,https://www.nytimes.com/2024/06/11/arts/television/presumed-innocent-review.html,Arts,The New York Times
Google Exemplifies the Lack of Competition in the Tech World,The antitrust ruling is just the beginning of the kind of regulation that digital monopolies require.,2024-08-06T09:04:07Z,https://www.nytimes.com/live/2024/08/07/opinion/thepoint/google-exemplifies-the-lack-of-competition-in-the-tech-world,Opinion,The New York Times
"A Love-Addled Apple Farmer, Inseparable Sisters and Other Fictional Heroes of Massachusetts","A vibrant cast narrates “North Woods,” Daniel Mason’s lyrical saga about the various inhabitants of a single home in Massachusetts, from the founding of this country to the present day.",2024-03-08T10:00:06Z,https://www.nytimes.com/2024/03/08/books/review/north-woods-daniel-mason.html,Books,The New York Times
6 of ‘The Greatest’ Songs,"Hear superlative tracks from Billie Eilish, Kenny Rogers and Alabama Shakes.",2024-10-01T18:00:05Z,https://www.nytimes.com/2024/10/01/arts/music/amplifier-newsletter-billie-eilish-greatest.html,Arts,The New York Times
9 Great Songs That Mention Baseball Stars,The playlist to get you through Major League Baseball’s long offseason.,2024-11-05T19:00:04Z,https://www.nytimes.com/2024/11/05/arts/music/amplifier-newsletter-bad-bunny-baseball.html,Arts,The New York Times
How to Make Typing Easier on the Phone and Leave the Laptop at Home,"Shortcuts, small external keyboards and even improved (and free) dictation software can make long sessions of text input much simpler.",2024-09-25T09:04:13Z,https://www.nytimes.com/2024/09/25/technology/personaltech/smartphone-typing-tips.html,Technology,The New York Times
"‘Rock Me, Joe’: 9 Songs With Great Guitar Cues","Celebrate the timeless rock ‘n’ roll tradition of a lead singer cuing up a guitarist by listening to tracks from Pixies, the Runaways and Jimi Hendrix.",2024-08-06T18:00:03Z,https://www.nytimes.com/2024/08/06/arts/music/rock-me-joe-9-songs-with-great-guitar-cues.html,Arts,The New York Times
10 Unforgettable Songs From 1999 Movies,"Listen to tracks by the Chicks, Aimee Mann, Blink-182 and more linked to moments in a monumentally interesting — and busy — year of cinema.",2024-08-30T18:00:03Z,https://www.nytimes.com/2024/08/30/arts/music/amplifier-newsletter-1999-movie-songs.html,Arts,The New York Times
"Lady Gaga’s ‘Joker,’ and a Tour of Musical Clowning","Clowns, harlequins, jokers and Pierrots have served as the main characters in countless songs over the years, but they’re rarely there to conjure cheap laughs.",2024-09-27T18:00:02Z,https://www.nytimes.com/2024/09/27/arts/music/amplifier-newsletter-clown-songs.html,Arts,The New York Times
What Will Warren Buffett Bet on Next?,"Berkshire Hathaway shareholders will gather in Omaha for the conglomerate’s annual meeting on Saturday, with questions about the company’s future.",2024-05-03T11:26:48Z,https://www.nytimes.com/2024/05/03/business/dealbook/warren-buffett-berkshire-hathaway-agm.html,Business,The New York Times
"Meet MJ Lenderman, Southern Rock’s Tragicomic Poet","Hear tracks from his new album, “Manning Fireworks,” and more.",2024-09-06T18:00:04Z,https://www.nytimes.com/2024/09/06/arts/music/amplifier-newsletter-mj-lenderman.html,Arts,The New York Times
How to Own Something by the Punk Poet Jun Takahashi,"GU, Uniqlo’s trendier sibling, is opening its first store outside Asia in SoHo, collaborating with the subversively witty Jun Takahashi of Undercover.",2024-09-19T07:00:29Z,https://www.nytimes.com/2024/09/19/style/jun-takahashi-collaboration-gu.html,Style,The New York Times
7 New Songs You Should Hear Now,"Listen to tracks from FKA twigs, Soccer Mommy, Mustafa and more.",2024-09-17T18:00:05Z,https://www.nytimes.com/2024/09/17/arts/music/amplifier-newsletter-fka-twigs-soccer-mommy.html,Arts,The New York Times
Our Mount Rushmore of Fictional Presidents,Jed Bartlett and other presidents of our youth.,2024-11-26T10:04:11Z,https://www.nytimes.com/2024/11/26/opinion/our-favorite-fictional-presidents.html,Opinion,The New York Times
7 New Songs You Should Hear Now,"Catch up on the latest from Soccer Mommy, Haley Heynderickx, Tyler, the Creator and more.",2024-11-15T19:00:03Z,https://www.nytimes.com/2024/11/15/arts/music/amplifer-newsletter-new-songs.html,Arts,The New York Times
A New Way to Hear The Amplifier (Plus 5 More Whistling Songs),"Listen to a deluxe edition of the playlist, including an addition from noted whistler Andrew Bird, now available on Apple Music.",2024-01-26T19:00:02Z,https://www.nytimes.com/2024/01/26/arts/music/amplifier-newsletter-apple-music.html,Arts,The New York Times
Why Your Favorite Restaurant Sounds Like That,"Owners are putting more thought than ever into the music playing through their speakers, sometimes tapping professionals for help.",2024-09-12T18:21:44Z,https://www.nytimes.com/2024/09/12/dining/restaurant-playlist.html,Food,The New York Times
Italian Pop Discoveries From My Vacation,"Hear songs from Angelina Mango, Patty Pravo and an unexpected hit by Conan Gray.",2024-07-16T18:00:02Z,https://www.nytimes.com/2024/07/16/arts/music/amplifier-newsletter-italian-pop.html,Arts,The New York Times
"Willie, Waylon and the Boys: the Ultimate Outlaw Country Primer","Hear songs from Willie Nelson, Waylon Jennings, Kris Kristofferson, Johnny Cash and more, inspired by a new book.",2024-09-24T18:00:06Z,https://www.nytimes.com/2024/09/24/arts/music/amplifier-newsletter-the-highwaymen-outlaw-country.html,Arts,The New York Times
The Best Crime Novels of the Year (So Far),"Looking for some murder and mayhem (fictional, of course)? Here are the best crime novels of 2024 so far.",2024-05-22T09:00:25Z,https://www.nytimes.com/2024/05/22/books/review/best-crime-novels-2024-so-far.html,Books,The New York Times
7 New Collaborations You Should Hear Now,"Hear music from pairings that include Lady Gaga and Bruno Mars, and Post Malone and Chris Stapleton.",2024-08-20T18:00:04Z,https://www.nytimes.com/2024/08/20/arts/music/amplifier-newsletter-lady-gaga-post-malone.html,Arts,The New York Times
"Antichrists, Chain Saws and Natalism: A Very ‘M.O.O.’ Halloween Episode","The hosts share their favorite scary movies, books and television series.",2024-10-16T19:32:40Z,https://www.nytimes.com/2024/10/16/opinion/scary-books-tv-movies.html,Opinion,The New York Times
An All ‘Independence’ Playlist for the Fourth of July,"Listen to songs by Martina McBride, Destiny’s Child, Kelly Clarkson and more.",2024-07-02T18:00:04Z,https://www.nytimes.com/2024/07/02/arts/music/amplifier-newsletter-independence-songs.html,Arts,The New York Times
‘The Dynasty’ Got the Secretive New England Patriots to Speak,"For an Apple TV+ docuseries, the tight-lipped sports franchise provided insight into six Super Bowl victories as well as darker moments.",2024-02-15T17:13:19Z,https://www.nytimes.com/2024/02/15/arts/television/dynasty-new-england-patriots-apple.html,Arts,The New York Times
The Harley Riders With a Taste for Tea and Apple Strudel,"The Harley Owners Group in Alice Springs is what’s known as a social motorcycle club, with the emphasis on social.",2024-04-26T05:18:42Z,https://www.nytimes.com/2024/04/26/world/australia/harley-club.html,World,The New York Times
5 Health Trends We Debunked This Year,"Apple cider vinegar, pimple patches, under-eye creams — do any of these actually work?",2024-08-14T09:00:40Z,https://www.nytimes.com/2024/08/14/well/2024-health-trends.html,Well,The New York Times
An Epic Summer Olympics Playlist,"Hear triumphant tracks from John Williams, Whitney Houston and, of course, Celine Dion.",2024-07-30T18:00:02Z,https://www.nytimes.com/2024/07/30/arts/music/amplifier-newsletter-olympics-celine-dion.html,Arts,The New York Times
Trumpism Is Not a Fad,"Why America went with Trump, again.",2024-11-06T18:05:03Z,https://www.nytimes.com/2024/11/06/opinion/trump-wins-election.html,Opinion,The New York Times
6 Ambient Tracks to Transport You Someplace Else,"Listen to Gas, Hiroshi Yoshimura and Lou Reed (yes, that Lou Reed).",2024-11-12T19:00:10Z,https://www.nytimes.com/2024/11/12/arts/music/amplifier-newsletter-ambient-gas-hiroshi-yoshimura.html,Arts,The New York Times
Why Is Big Tech Still Cutting Jobs?,Profits are up and the economy is strong. But the tech industry faces two challenges — dealing with a frenetic work force expansion in the pandemic and building A.I.,2024-02-05T10:03:06Z,https://www.nytimes.com/2024/02/05/technology/why-is-big-tech-still-cutting-jobs.html,Technology,The New York Times
10 Outstanding Brian Eno Productions,"Inspired by an ever-changing new documentary about the musician and producer, listen to songs he helped construct by David Bowie, Talking Heads, U2 and more.",2024-07-19T18:00:04Z,https://www.nytimes.com/2024/07/19/arts/music/amplifier-newsletter-brian-eno-productions.html,Arts,The New York Times
There were some notable absences from the hearing.,,2024-01-31T19:04:43Z,https://www.nytimes.com/live/2024/01/31/technology/child-safety-senate-hearing/there-are-some-notable-absences-from-the-hearing,Technology,The New York Times
10 Outstanding Brian Eno Productions,"Inspired by an ever-changing new documentary about the musician and producer, listen to songs he helped construct by David Bowie, Talking Heads, U2 and more.",2024-07-19T18:00:04Z,https://www.nytimes.com/2024/07/19/arts/music/amplifier-newsletter-brian-eno-productions.html,Arts,The New York Times
A Bouquet of Songs for May Flowers,"Tom Petty, Patrice Rushen, Billie Eilish and more.",2024-05-24T18:00:10Z,https://www.nytimes.com/2024/05/24/arts/music/amplifier-newsletter-may-flowers.html,Arts,The New York Times
6 Social Media Accounts That Changed How I Rediscover Music,"Hear songs surfaced by Ryley Walker, Drumeo and other feeds from Bring Me the Horizon, Lil Tecca and more.",2024-10-22T18:00:03Z,https://www.nytimes.com/2024/10/22/arts/music/amplifier-newsletter-music-social-media-accounts.html,Arts,The New York Times
9 Great Songs Recorded at Electric Lady Studios,"A new documentary spotlights the Greenwich Village creative hub. Listen to tracks by Jimi Hendrix, Patti Smith, Frank Ocean and more that were recorded there.",2024-08-13T18:00:03Z,https://www.nytimes.com/2024/08/13/arts/music/amplifier-newsletter-electric-lady-studios.html,Arts,The New York Times
The S&P 500 Through the Prism of a ‘Magnificent 7’,"Seven tech stocks, including Meta, Nvidia and Apple, have accounted for roughly 90 percent of the S&P’s gains over the past 12 months.",2024-01-27T10:00:45Z,https://www.nytimes.com/interactive/2024/01/27/business/what-are-magnificent-seven-stocks.html,Business,The New York Times
Kendrick Lamar’s Never-Ending Battles,"The Los Angeles rapper returns with his (surprise) sixth album, itching to escape his Drake drama, but still benefiting from it.",2024-11-28T14:32:02Z,https://www.nytimes.com/2024/11/28/arts/music/popcast-kendrick-lamar.html,Arts,The New York Times
"If Nvidia Keeps Rising Like This, It Will Be Bigger Than the Global Economy",A.I. fervor has rocketed the chip company’s share price upward. Our columnist asked A.I. chatbots how big Nvidia would become if it kept growing as fast as it had over the past year.,2024-03-15T13:00:08Z,https://www.nytimes.com/2024/03/15/business/nvidia-stock-market-ai-bubble.html,Business,The New York Times
Rock Around the Clock: 8 Songs About Very Specific Times of Day,"Hear tracks by the Strokes, beabadoobee, Normani and more.",2024-06-11T18:00:17Z,https://www.nytimes.com/2024/06/11/arts/music/amplifier-newsletter-time-songs.html,Arts,The New York Times
9 Surprising Songs Sampled in Classic Hip-Hop Tracks,"Hear where moments of Kraftwerk, Enya, Herb Alpert and more ended up in producers’ deft hands.",2024-08-27T18:00:06Z,https://www.nytimes.com/2024/08/27/arts/music/amplifier-newsletter-hip-hop-samples.html,Arts,The New York Times
The Sunday Read: ‘My Goldendoodle Spent a Week at Some Luxury Dog ‘Hotels.’ I Tagged Along.’,How exactly did dogs take over our world? This writer journeys into the bespoke pet care industry to find out.,2024-03-24T10:00:13Z,https://www.nytimes.com/2024/03/24/podcasts/the-daily/the-sunday-read-my-goldendoodle-spent-a-week-at-some-luxury-dog-hotels-i-tagged-along.html,Podcasts,The New York Times
Is China’s Era of High Growth Over?,"Beijing unveiled an annual economic target in line with last year’s, as it looks to refocus on strategically important sectors.",2024-03-05T13:27:33Z,https://www.nytimes.com/2024/03/05/business/dealbook/china-era-high-growth-over.html,Business,The New York Times
My Starting Five Songs From Boston and Dallas,"Catch the N.B.A. Finals spirit with Erykah Badu, Pixies, Kelly Clarkson and more.",2024-06-07T18:00:03Z,https://www.nytimes.com/2024/06/07/arts/music/amplifier-newsletter-boston-dallas-songs.html,Arts,The New York Times
7 New Songs You Should Hear Now,"The latest tracks from Mdou Moctar, St. Vincent, Willie Nelson and more.",2024-03-19T18:00:42Z,https://www.nytimes.com/2024/03/19/arts/music/amplifier-newsletter-new-songs.html,Arts,The New York Times
The Ultimate Dad Rock Playlist,"What is dad rock? You know it when you hear it, so listen to 10 songs from Wilco, the Grateful Dead, Steely Dan and more.",2024-06-14T18:00:03Z,https://www.nytimes.com/2024/06/14/arts/music/amplifier-newsletter-dad-rock.html,Arts,The New York Times
You Texted? I Hadn’t Noticed.,“Do Not Disturb” mode lets smartphone users silence notifications — and signals that they may take a while to respond.,2024-03-13T09:05:56Z,https://www.nytimes.com/2024/03/13/style/do-not-disturb-phone-setting.html,Style,The New York Times
Chappell Roan’s Rocket-Ship Year,"The pop star’s ascent has tested the boundaries of contemporary pop, and may create a template for a next generation.",2024-10-21T13:29:35Z,https://www.nytimes.com/2024/10/21/arts/music/popcast-chappell-roan.html,Arts,The New York Times
7 Hot Tracks From a New Generation of Female Rappers,"Listen to recent songs from Megan Thee Stallion, Ice Spice, Latto and more.",2024-08-16T18:00:02Z,https://www.nytimes.com/2024/08/16/arts/music/amplifier-newsletter-female-rappers.html,Arts,The New York Times
How Will Popular Culture Change in Trump’s Second Term?,His first term was marked by backlash and protest. But the president-elect has found new streams of embrace and approval.,2024-11-20T23:09:47Z,https://www.nytimes.com/2024/11/20/arts/music/popcast-trump-pop-culture.html,Arts,The New York Times
The Best Thrillers of the Year (So Far),These twisty suspense novels will keep you on the edge of your seat.,2024-06-08T09:00:33Z,https://www.nytimes.com/2024/06/08/books/review/best-thrillers-books.html,Books,The New York Times
The Best Thrillers of the Year (So Far),These twisty suspense novels will keep you on the edge of your seat.,2024-06-08T09:00:33Z,https://www.nytimes.com/2024/06/08/books/review/best-thrillers-books.html,Books,The New York Times
Here’s Why Stock Indexes Sank on Tuesday,The market drop was primarily focused on Nvidia and other tech companies.,2024-09-04T16:41:54Z,https://www.nytimes.com/live/2024/09/03/opinion/thepoint/stock-market-nvidia,Opinion,The New York Times
The 100 Best Books of the 21st Century,As voted on by 503 book lovers — with a little help from the staff of The New York Times Book Review.,2024-07-08T00:01:23Z,https://www.nytimes.com/interactive/2024/books/best-books-21st-century.html,Books,The New York Times
What Can Your ‘Training Load’ Tell You About Your Fitness?,The metric is available on most fitness trackers. Here’s what it means.,2024-09-21T09:02:00Z,https://www.nytimes.com/2024/09/21/well/move/training-load-apple-watch-garmin.html,Well,The New York Times
We Tried the Apple Vision Pro + Can Congress Protect Kids Online? + Cruise’s Crash,Introducing DJ TaskRabbit.,2024-02-02T10:03:43Z,https://www.nytimes.com/2024/02/02/podcasts/hard-fork-vision-pro-senate-hearing-cruise.html,Podcasts,The New York Times
The Ultimate Charli XCX Primer,"Prep for the arrival of her new album, “Brat,” with 11 songs from her catalog (and 10 bonus tracks!).",2024-06-04T18:02:47Z,https://www.nytimes.com/2024/06/04/arts/music/amplifier-newsletter-charli-xcx.html,Arts,The New York Times
"The New York Times News Quiz, June 14, 2024",Did you follow the news this week? Take our quiz to see how well you stack up with other Times readers.,2024-06-14T09:05:53Z,https://www.nytimes.com/interactive/2024/06/14/briefing/hunter-biden-apple-jerry-west-quiz.html,Briefing,The New York Times
‘Someone’s Going to End Up Dead’: Settlements Over Fatal Astroworld Concert,A trial had been set to hear evidence that organizers of a 2021 Travis Scott concert knew the crowd was too large and ignored pleas to stop it as 10 people were crushed.,2024-05-08T22:43:53Z,https://www.nytimes.com/2024/05/08/us/astroworld-travis-scott-concert-deaths.html,U.S.,The New York Times
8 New Songs You Should Hear Now,"Listen to songs by Clairo, Dawn Richard and Sturgill Simpson plus more.",2024-07-23T18:00:05Z,https://www.nytimes.com/2024/07/23/arts/music/amplifier-newsletter-clairo-new-songs.html,Arts,The New York Times
‘Sugar’ Review: In a Lonely Place With Colin Farrell,This Apple TV+ mystery celebrates and subverts film noir.,2024-04-05T09:03:12Z,https://www.nytimes.com/2024/04/05/arts/television/sugar-review-colin-farrell.html,Arts,The New York Times
7 New Songs You Should Hear Now,Listen to Lorde tell her side of the story on a surprise remix with Charli XCX and more new songs.,2024-06-25T18:00:03Z,https://www.nytimes.com/2024/06/25/arts/music/amplifier-newsletter-charli-xcx-lorde.html,Arts,The New York Times
"Stanley Tucci on His New Book, ‘What I Ate in One Year’","The actor and renowned foodie talks about his eating habits and his food diary, and we look at the fiction and nonfiction titles up for the National Book Award.",2024-10-11T20:11:39Z,https://www.nytimes.com/2024/10/11/books/review/stanley-tucci-what-i-ate-in-one-year-interview.html,Books,The New York Times
15 Great Donald Sutherland Performances to Stream,"Whether in the lead or a supporting role, the actor’s immense talent and range were apparent in six decades of performances.",2024-06-21T15:24:38Z,https://www.nytimes.com/2024/06/21/movies/donald-sutherland-streaming.html,Movies,The New York Times
7 New Songs You Should Hear Now,"Hear tracks from Carly Pearce, Ibibio Sound Machine, John Cale and more.",2024-05-21T18:00:03Z,https://www.nytimes.com/2024/05/21/arts/music/amplifier-newsletter-new-songs.html,Arts,The New York Times
