title,snippet,pub_date,web_url,section,source
What Happens in Vegas Could Decide the Election,"Exploring the impact of the housing crisis in Nevada, a swing state the Democrats have counted on for nearly two decades.",2024-10-21T10:00:13Z,https://www.nytimes.com/2024/10/21/podcasts/the-daily/vegas-nevada-election.html,Podcasts,The New York Times
6 New Songs You Should Hear Now,"Hear tracks from Tyla, Chappell Roan, Young Miko and more.",2024-04-16T18:00:03Z,https://www.nytimes.com/2024/04/16/arts/music/amplifier-newsletter-new-songs.html,Arts,The New York Times
The Little Streamer That Could,"Tubi has exploded in popularity over the past 18 months, outpacing some competitors with much bigger budgets.",2024-08-13T14:47:39Z,https://www.nytimes.com/2024/08/13/business/media/tubi-movies-tv-streaming.html,Business,The New York Times
9 Sunny Songs for Springing Ahead,"To celebrate the return of daylight saving time, here’s a playlist full of songs about sunshine and daylight.",2024-03-12T18:00:06Z,https://www.nytimes.com/2024/03/12/arts/music/amplifier-newsletter-sunny-songs.html,Arts,The New York Times
Will Republicans Reject Gaetz?,The choice of Matt Gaetz shocked Washington and raised questions about whether the Senate would approve him.,2024-11-18T11:00:22Z,https://www.nytimes.com/2024/11/18/podcasts/the-daily/gaetz-attorney-general.html,Podcasts,The New York Times
The Cookbook ‘French Boulangerie’ Embraces Fermentation and Goes Beyond France,"Try a cooking oil made from algae, pick up a citrus wheel plate and more food news.",2024-02-12T17:32:43Z,https://www.nytimes.com/2024/02/12/dining/fermentation-cookbook-food-news.html,Food,The New York Times
Two Blue States That Will Determine Control of Congress,New York and California have become unlikely focal points in the fight for control of the House.,2024-10-15T10:00:09Z,https://www.nytimes.com/2024/10/15/podcasts/the-daily/congress-election.html,Podcasts,The New York Times
Why Abortion Rights Won Even as Kamala Harris Lost,"Voters in red and blue states supported abortion rights, but the movement’s winning streak came to an end.",2024-11-12T11:00:16Z,https://www.nytimes.com/2024/11/12/podcasts/the-daily/abortion-rights-election.html,Podcasts,The New York Times
How to track your favorite runners.,,2024-11-03T11:48:16Z,https://www.nytimes.com/live/2024/11/03/nyregion/nyc-marathon/how-to-track-your-favorite-runners,New York,The New York Times
Dabney Coleman: Where to Stream His Best Movies and TV Shows,Coleman’s characters frequently displayed the kind of antagonistic demeanor familiar to anyone who has ever dealt with a bad boss or a disgruntled customer.,2024-05-18T09:05:26Z,https://www.nytimes.com/2024/05/18/arts/television/dabney-coleman-9-to-5-movies-tv.html,Arts,The New York Times
How to Cut Down Your Screen Time but Still Get Stuff Done,Google’s Routines and Apple’s Shortcuts combine multiple steps into one command to make your phone or tablet do more of the work for you.,2024-01-17T14:00:27Z,https://www.nytimes.com/2024/01/17/technology/personaltech/screen-time-phone.html,Technology,The New York Times
7 Rainy Songs for April Showers,"Hear tracks by Neil Young, FKA twigs, Love Unlimited and more.",2024-04-02T18:00:21Z,https://www.nytimes.com/2024/04/02/arts/music/amplifier-newsletter-rainy-april-songs.html,Arts,The New York Times
U.S. Proposes Breakup of Google to Fix Search Monopoly,"In a landmark antitrust case, the government asked a judge to force the company to sell its popular Chrome browser.",2024-11-21T00:44:56Z,https://www.nytimes.com/2024/11/20/technology/google-search-chrome-doj.html,Technology,The New York Times
"Beatles Get a Biopic. A Fab Four of Them, Actually.","The Oscar-winning filmmaker Sam Mendes was given full rights to the band’s music and their life stories for the unusual quartet of films, planned for 2027.",2024-02-20T21:15:24Z,https://www.nytimes.com/2024/02/20/movies/four-beatles-biopics-sam-mendes.html,Movies,The New York Times
"19 Days to Go: Early Voting, Dance Parties and Third Parties",Watch or listen to our political round table.,2024-10-17T10:00:13Z,https://www.nytimes.com/2024/10/17/podcasts/the-daily/election-roundtable.html,Podcasts,The New York Times
Donald Trump’s America,How the former president staged his comeback and how he might change the direction of the country.,2024-11-07T11:00:13Z,https://www.nytimes.com/2024/11/07/podcasts/the-daily/donald-trump-america.html,Podcasts,The New York Times
"The Best Movies and TV Shows Coming to Disney+, Amazon, Apple TV+ and More in October","“Citadel: Diana,” “Disclaimer,” “The Franchise,” “Star Trek: Lower Decks,” a Springsteen documentary and others arrive.",2024-10-01T18:10:05Z,https://www.nytimes.com/2024/10/01/arts/television/october-streaming-movies-shows.html,Arts,The New York Times
30 Shows to Watch This Summer,"Returning favorites include “The Bear,” “House of the Dragon” and “Only Murders in the Building.” Among the new arrivals? Jake Gyllenhaal and Natalie Portman.",2024-06-06T17:12:30Z,https://www.nytimes.com/2024/06/06/arts/television/summer-tv-premieres-house-of-the-dragon-the-bear.html,Arts,The New York Times
The Parents Aren’t All Right,"Parents report being more stressed than other adults, and the U.S. surgeon general now considers raising a family a health risk.",2024-10-09T10:00:15Z,https://www.nytimes.com/2024/10/09/podcasts/the-daily/parenting-stress.html,Podcasts,The New York Times
Democrats Search for Answers,"After their election loss, the party’s leaders are pointing fingers and wrestling with what it stands for.",2024-11-11T11:00:16Z,https://www.nytimes.com/2024/11/11/podcasts/the-daily/democrats-blame-answers.html,Podcasts,The New York Times
Aid for Gazans Has Come to a Near-Total Halt,"Also, A.I.Phones and Eurovision. Here’s the latest at the end of Friday.",2024-05-10T21:18:53Z,https://www.nytimes.com/2024/05/10/briefing/gaza-aid-artificial-intelligence-apple-iphone.html,Briefing,The New York Times
Here’s where to stream Emmy-nominated series.,,2024-01-16T00:00:09Z,https://www.nytimes.com/live/2024/01/15/arts/emmy-awards/heres-where-to-stream-emmy-nominated-series,Arts,The New York Times
Judge Sets 2025 Timeline for Remedies to Google’s Search Monopoly,"After ruling against Google last month, Judge Amit P. Mehta said he would take until next August to determine fixes that the company must make.",2024-09-06T20:12:29Z,https://www.nytimes.com/2024/09/06/technology/google-search-antitrust-remedies.html,Technology,The New York Times
"Trump, Again",An early-morning conversation about the state of the election and the potential consequences of a second term for Donald J. Trump.,2024-11-06T11:00:09Z,https://www.nytimes.com/2024/11/06/podcasts/the-daily/trump-election.html,Podcasts,The New York Times
The Race That Could Tip Control of the Senate,"Montana’s three-term Democratic senator, Jon Tester, is facing a tough race with increasingly high stakes.",2024-10-16T10:00:15Z,https://www.nytimes.com/2024/10/16/podcasts/the-daily/senate-2024.html,Podcasts,The New York Times
This Is How Democrats Win in Wisconsin,"Ben Wikler, the chair of the Democratic Party of Wisconsin, discusses whether Kamala Harris can appeal to voters in the swing state.",2024-07-26T09:05:06Z,https://www.nytimes.com/2024/07/26/opinion/ezra-klein-podcast-ben-wikler.html,Opinion,The New York Times
"Six Days Left: Closing Arguments, Racist Jokes and Burning Ballots",Watch or listen to our final round table before Election Day.,2024-10-30T10:00:13Z,https://www.nytimes.com/2024/10/30/podcasts/the-daily/election-roundtable.html,Podcasts,The New York Times
"As Marijuana’s Popularity Grows, So Do Its Harms",More Americans are consuming more potent forms of the drug more often. And some of the heaviest users are experiencing unexpected health effects.,2024-10-22T10:00:09Z,https://www.nytimes.com/2024/10/22/podcasts/the-daily/marijuanas-harms.html,Podcasts,The New York Times
The Ad Campaign,Advertising is the biggest expense in a race expected to cost $3.5 billion. These are the stories the candidates are using it to tell.,2024-11-04T11:00:13Z,https://www.nytimes.com/2024/11/04/podcasts/the-daily/election-campaign-ads.html,Podcasts,The New York Times
The Metamorphosis of Pete Hegseth,Three military deployments reshaped the views of President-elect Donald J. Trump’s pick to lead the Defense Department.,2024-11-26T11:00:15Z,https://www.nytimes.com/2024/11/26/podcasts/the-daily/pete-hegseth.html,Podcasts,The New York Times
I Watched the Republican Convention. The Democrats Can Still Win.,Ezra Klein discusses the anti-system populism on display at the 2024 G.O.P. convention — and what this might mean for the Democrats.,2024-07-20T11:00:13Z,https://www.nytimes.com/2024/07/20/opinion/ezra-klein-podcast-rnc.html,Opinion,The New York Times
Trump Defeats Harris to Retake the Presidency,"Plus, Republicans win control of the Senate.",2024-11-06T11:00:12Z,https://www.nytimes.com/2024/11/06/podcasts/trump-victory-republican-senate.html,Podcasts,The New York Times
The Walz-Vance Debate: Civility and Then a Clash,"The vice-presidential candidates sparred over immigration, abortion and the Jan. 6 riot.",2024-10-02T10:01:09Z,https://www.nytimes.com/2024/10/02/podcasts/the-daily/walz-vance-debate.html,Podcasts,The New York Times
12 Days to Go: French Fries and Fascism,Watch or listen to our political round table.,2024-10-24T10:00:17Z,https://www.nytimes.com/2024/10/24/podcasts/the-daily/election-round-table.html,Podcasts,The New York Times
The Year Since Oct. 7,Two men in Israel and Gaza talk about how their lives have changed.,2024-10-07T10:00:20Z,https://www.nytimes.com/2024/10/07/podcasts/the-daily/oct-7-anniversary.html,Podcasts,The New York Times
The Army of Election Officials Ready to Reject the Vote,An investigation in four battleground states found that Republicans have taken control of election boards with the aim of challenging and overturning results that don’t go their way.,2024-11-01T10:00:13Z,https://www.nytimes.com/2024/11/01/podcasts/the-daily/election-officials.html,Podcasts,The New York Times
Four Weeks to Go,"With Kamala Harris and Donald Trump locked in the tightest of races, who will come out on top? Watch or listen to our political round table on the 2024 election.",2024-10-04T10:00:15Z,https://www.nytimes.com/2024/10/04/podcasts/the-daily/presidential-election.html,Podcasts,The New York Times
My Dad Is George Lopez. We Healed Our Relationship With a Sitcom.,Mayan Lopez found a way to turn her family drama into laughter.,2024-10-30T09:03:07Z,https://www.nytimes.com/2024/10/30/podcasts/mayan-lopez-george-lopez-show-relationship.html,Podcasts,The New York Times
5 of My Most Anticipated Albums of the Fall,"A new indie-rock supergroup, a fruitful (if unexpected) partnership, an alt-rock icon going solo and more.",2024-09-13T18:00:04Z,https://www.nytimes.com/2024/09/13/arts/music/amplifier-newsletter-fall-albums.html,Arts,The New York Times
Were We the ‘Fat Couple’?,"When Courtenay was alone with her boyfriend, her body shame disappeared. But when they left the house, it felt different.",2024-10-02T09:01:21Z,https://www.nytimes.com/2024/10/02/podcasts/were-we-the-fat-couple.html,Podcasts,The New York Times
Meet the 8 best new artist nominees.,,2024-02-05T01:00:05Z,https://www.nytimes.com/live/2024/02/04/arts/grammy-awards/meet-the-8-best-new-artist-nominees,Arts,The New York Times
"Toni Braxton, Whoopi Goldberg Fan, Watches ‘The View’ in Her Pajamas","“I love a good debate,” said the R&B singer and actress, who can be seen alongside her sisters in the TV series “The Braxtons.” “It doesn’t always make you smile, but it always provokes thought.”",2024-08-24T09:04:08Z,https://www.nytimes.com/2024/08/24/arts/television/toni-braxton-reality-show.html,Arts,The New York Times
The Murder of Laken Riley,President-elect Donald J. Trump has repeatedly cited the case in his push for the mass deportation of millions of undocumented people.,2024-11-21T11:00:20Z,https://www.nytimes.com/2024/11/21/podcasts/the-daily/laken-riley-murder.html,Podcasts,The New York Times
Popcast (Deluxe): A Word With Action Bronson,"The rapper and gourmand answers our rapid-fire questionnaire covering the music of his childhood, how he manages stress and his go-to bodega order.",2024-08-15T22:00:06Z,https://www.nytimes.com/2024/08/15/arts/music/popcast-action-bronson-interview.html,Arts,The New York Times
"Google Must Open Android to Other App Stores and Billing Options, Judge Rules",The internet giant was ordered by a federal judge to make a series of changes to address its anticompetitive conduct.,2024-10-07T21:21:20Z,https://www.nytimes.com/2024/10/07/technology/google-app-store-epic-games-anticompetitive.html,Technology,The New York Times
Trump 2.0: A Presidency Driven by Revenge,"As president, Donald Trump repeatedly tried to use his powers to penalize his enemies. What might a second term mean for American democracy?",2024-10-11T10:00:12Z,https://www.nytimes.com/2024/10/11/podcasts/the-daily/trump-revenge.html,Podcasts,The New York Times
Inside an Unprepared Secret Service,The protection agency is facing questions after two assassination attempts on former President Donald J. Trump.,2024-10-14T10:00:12Z,https://www.nytimes.com/2024/10/14/podcasts/the-daily/secret-service.html,Podcasts,The New York Times
"Corrections: Oct. 13, 2024","Corrections that appeared in print on Sunday, Oct. 13, 2024.",2024-10-13T08:00:02Z,https://www.nytimes.com/2024/10/13/pageoneplus/corrections-oct-13-2024.html,Corrections,The New York Times
The Gender Election,Men under 30 are much more likely to support Donald Trump than women their age. It’s a far bigger gender gap than in older generations.,2024-10-23T10:00:13Z,https://www.nytimes.com/2024/10/23/podcasts/the-daily/gender-election.html,Podcasts,The New York Times
Smartphones Can Now Last 7 Years. Here’s How to Keep Them Working.,Google and Samsung used to update smartphone software for only three years. That has changed.,2024-05-15T13:00:21Z,https://www.nytimes.com/2024/05/15/technology/personaltech/smartphones-software-update-ios-android.html,Technology,The New York Times
A Sudden Escalation in Ukraine Before Trump Takes Office,"Long-range missiles, North Korean troops and starker threats from Russia — the war has entered a more volatile phase.",2024-11-25T11:00:15Z,https://www.nytimes.com/2024/11/25/podcasts/the-daily/ukraine-missiles-trump.html,Podcasts,The New York Times
Hurricane Helene’s 600 Miles of Destruction,"The storm swept through southern parts of the United States, carving a trail of lost lives and mangled homes.",2024-10-01T10:00:13Z,https://www.nytimes.com/2024/10/01/podcasts/the-daily/hurricane-helene.html,Podcasts,The New York Times
Amelia Dimoldenberg Can Teach You How to Flirt,"The YouTube host who has perfected the art of charming celebrities on her popular show, “Chicken Shop Date,” thinks dating should be way more fun.",2024-10-16T09:01:00Z,https://www.nytimes.com/2024/10/16/podcasts/modern-love-amelia-dimoldenberg-flirt.html,Podcasts,The New York Times
The Trump Campaign’s Big Gamble,"A look inside the operation’s field office in Maricopa County, Ariz.",2024-10-28T10:00:40Z,https://www.nytimes.com/2024/10/28/podcasts/the-daily/trump-campaign-arizona.html,Podcasts,The New York Times
Black Voters and the Democratic Party: One Family’s Story,"Strong support from Black Americans will be crucial if Kamala Harris is to win states like Georgia — and, potentially, the presidency.",2024-10-31T10:00:13Z,https://www.nytimes.com/2024/10/31/podcasts/the-daily/black-voters-democratic-party.html,Podcasts,The New York Times
"The Trump Transition’s Secret Funding, and a Campus Crackdown","Plus, payouts for finding pandemic fraud.",2024-11-25T11:00:13Z,https://www.nytimes.com/2024/11/25/podcasts/trump-donors-student-protest.html,Podcasts,The New York Times
"The Trump Transition’s Secret Funding, and a Campus Crackdown","Plus, payouts for finding pandemic fraud.",2024-11-25T11:00:13Z,https://www.nytimes.com/2024/11/25/podcasts/trump-donors-student-protest.html,Podcasts,The New York Times
How Israel Uses Palestinian Detainees as Human Shields,"An investigation into an Israeli tactic in Gaza, and what it reveals about the nature of the war there.",2024-11-27T11:00:08Z,https://www.nytimes.com/2024/11/27/podcasts/the-daily/israel-gaza-human-shields.html,Podcasts,The New York Times
7 Artists Shaping the Sound of 2024,"Hear songs from Tanner Adell, Bizarrap and Young Miko, and more.",2024-03-15T18:00:04Z,https://www.nytimes.com/2024/03/15/arts/music/amplifier-newsletter-tanner-adell-that-mexican-ot.html,Arts,The New York Times
Israel Kills The Leader of Hamas,"Yahya Sinwar, the leader of Hamas, was killed by Israeli forces in Gaza. What does that mean for cease-fire talks?",2024-10-18T10:00:14Z,https://www.nytimes.com/2024/10/18/podcasts/the-daily/israel-sinwar-oct-7.html,Podcasts,The New York Times
"Weekly Student News Quiz: Israel-Hamas War, Medical Breakthrough, Apple",Have you been paying attention to current events recently? See how many of these 10 questions you can get right.,2024-03-26T12:07:29Z,https://www.nytimes.com/interactive/2024/03/26/learning/26StudentNewsQuiz.html,The Learning Network,The New York Times
"Weekly Student News Quiz: Primary Elections, Apple, 'Dune'",Have you been paying attention to current events recently? See how many of these 10 questions you can get right.,2024-03-05T13:01:30Z,https://www.nytimes.com/interactive/2024/03/05/learning/05StudentNewsQuiz.html,The Learning Network,The New York Times
A Trans-Atlantic Crackdown,Authorities in Europe and the U.S. are cracking down on big technology companies.,2024-03-05T11:36:25Z,https://www.nytimes.com/2024/03/05/briefing/big-tech-regulation.html,Briefing,The New York Times
"Israel Attacks on Multiple Fronts, and Helene’s Trail of Destruction","Plus, the plain-spoken poetry of Kris Kristofferson.",2024-09-30T10:00:18Z,https://www.nytimes.com/2024/09/30/podcasts/israel-houthis-yemen-hurricane-helene.html,Podcasts,The New York Times
25 Days to Go,"In the final sprint to Election Day, which voters matter most to the Harris and Trump campaigns? Watch or listen to our political round table.",2024-10-10T10:00:18Z,https://www.nytimes.com/2024/10/10/podcasts/the-daily/election-roundtable.html,Podcasts,The New York Times
"One Last Conversation, With the Help of A.I.",All Madeline wanted was to talk with Eli again. Recreating his voice with A.I. changed the way she grieved.,2024-10-23T09:03:49Z,https://www.nytimes.com/2024/10/23/podcasts/one-last-conversation-with-the-help-of-ai.html,Podcasts,The New York Times
Trump 2.0: A Cabinet Full of Surprises and an Awkward Visit With Joe Biden,Listen to our political round table on Donald J. Trump’s first week as president-elect.,2024-11-14T11:00:21Z,https://www.nytimes.com/2024/11/14/podcasts/the-daily/trump-cabinet.html,Podcasts,The New York Times
Elon Musk Launches Into American Politics,The world’s richest man may now be the single most influential figure in the emerging White House of Donald Trump.,2024-11-13T11:00:15Z,https://www.nytimes.com/2024/11/13/podcasts/the-daily/elon-musk-trump.html,Podcasts,The New York Times
He Saved Me. Now It Was My Turn to Save Him.,"They say it’s a bad idea to start a new relationship when you’re fighting an addiction, but Laura Cathcart Robbins decided she had to break the rules.",2024-11-13T10:02:19Z,https://www.nytimes.com/2024/11/13/podcasts/modern-love-marriage-made-an-actor-out-of-me.html,Podcasts,The New York Times
‘Sugar’ Actress Kirby on the Only Album She Really Needs,"She co-starred in the Apple TV+ show with Colin Farrell after appearing in “Killing Eve” and “Barry.” Now when she does a red carpet, she knows to go with Doc Martens.",2024-06-01T09:03:39Z,https://www.nytimes.com/2024/06/01/arts/television/kirby-sugar.html,Arts,The New York Times
Peanut Butter Walks Into a Chocolate Cookie Bar,"And the result is a rich, fudgy-centered treat that’s somewhere between a cookie and a brownie.",2024-10-26T15:00:02Z,https://www.nytimes.com/2024/10/26/dining/peanut-butter-walks-into-a-chocolate-cookie-bar.html,Food,The New York Times
"The Death of Yahya Sinwar, and Execution Halted in Shaken Baby Case","Plus, closing time for Kmart.",2024-10-18T10:00:13Z,https://www.nytimes.com/2024/10/18/podcasts/hamas-sinwar-texas-execution.html,Podcasts,The New York Times
The Basics of Smartphone Backups,"It doesn’t take a lot of work to keep copies of your phone’s photos, videos and other files stashed securely in case of an emergency.",2024-04-17T09:03:03Z,https://www.nytimes.com/2024/04/17/technology/personaltech/smartphone-iphone-backup.html,Technology,The New York Times
"Early Voting Grows Among Republicans, and a Lithium Trove in Arkansas","Plus, the booming Halloween economy.",2024-10-22T10:00:58Z,https://www.nytimes.com/2024/10/22/podcasts/early-voting-lithium.html,Podcasts,The New York Times
How NAFTA Broke American Politics,"Since its passage in 1993, the trade agreement has played an outsize role in presidential elections.",2024-10-08T10:00:15Z,https://www.nytimes.com/2024/10/08/podcasts/the-daily/american-politics-trade.html,Podcasts,The New York Times
"Election Day Decisions, and Why the Count Could Take Awhile","Plus, how astronauts vote from space.",2024-11-05T11:00:14Z,https://www.nytimes.com/2024/11/05/podcasts/election-day.html,Podcasts,The New York Times
"Election Day Decisions, and Why the Count Could Take Awhile","Plus, how astronauts vote from space.",2024-11-05T11:00:14Z,https://www.nytimes.com/2024/11/05/podcasts/election-day.html,Podcasts,The New York Times
"Harris Makes Her Final Case, and Trump Seizes on ‘Garbage’","Plus, refunds for canceled flights.",2024-10-30T10:00:14Z,https://www.nytimes.com/2024/10/30/podcasts/harris-trump-garbage.html,Podcasts,The New York Times
"Popcast: Kendrick Lamar at the Super Bowl, Sabrina Carpenter on Top","Plus: A conversation about the career of Rich Homie Quan, who died last week.",2024-09-11T21:27:49Z,https://www.nytimes.com/2024/09/11/arts/music/popcast-kendrick-lamar-sabrina-carpenter.html,Arts,The New York Times
Emmy Nominees 2024: The Complete List,The 76th Emmy Awards ceremony is planned for Sept. 15. See all the nominees below.,2024-07-17T15:00:13Z,https://www.nytimes.com/2024/07/17/arts/television/emmy-nominees-list-2024.html,Arts,The New York Times
"Democrats Begin the Blame Game, and What Happens to Trump’s Legal Woes","Plus, pickleball’s Super Bowl.",2024-11-07T11:00:14Z,https://www.nytimes.com/2024/11/07/podcasts/democrats-trump-legal-cases.html,Podcasts,The New York Times
9 Musicians Who Play a Role in This Year’s Oscars,"Hear songs by Dua Lipa, Jarvis Cocker and yes, Bradley Cooper.",2024-03-08T19:00:04Z,https://www.nytimes.com/2024/03/08/arts/music/amplifier-newsletter-musicians-oscars.html,Arts,The New York Times
"What the Final Polls Tell Us, and the Music Great Quincy Jones Dies","Plus, right-wing groups prepare to dispute the election.",2024-11-04T11:00:14Z,https://www.nytimes.com/2024/11/04/podcasts/final-polls-quincy-jones.html,Podcasts,The New York Times
Alliance vs. Isolation: Harris and Trump’s Competing Views on Foreign Policy,How the candidates position themselves regarding the wars in Ukraine and the Middle East.,2024-09-30T10:00:18Z,https://www.nytimes.com/2024/09/30/podcasts/the-daily/harris-trumps-foreign-policy.html,Podcasts,The New York Times
"In ‘The Big Cigar,’ a Black Panther Stars in a Fake Movie",This new series is based on the unlikely true story of a Hollywood producer who used a bogus film production to help Huey Newton flee to Cuba in 1974.,2024-05-11T09:03:14Z,https://www.nytimes.com/2024/05/11/arts/television/the-big-cigar.html,Arts,The New York Times
How to Win a Zillion Blue Ribbons? Ask the State Fair All-Stars.,"They’re the home-run heroes of cooking, baking and canning. Meet seven players who dominate the competitions season after season.",2024-08-07T09:00:38Z,https://www.nytimes.com/2024/08/07/dining/state-fair-food.html,Food,The New York Times
Is Kamala Harris Underrated?,The political journalist Elaina Plott Calabro traces the political trajectory of the vice president — and why her 2016 image might be just right for 2024.,2024-07-05T09:02:25Z,https://www.nytimes.com/2024/07/05/opinion/ezra-klein-podcast-kamala-harris.html,Opinion,The New York Times
Myha’la’s Relationship Advice? Get in a Fight.,The “Industry” star on how she learned to have a healthy argument with her new fiancé.,2024-09-25T09:03:22Z,https://www.nytimes.com/2024/09/25/podcasts/myhalas-relationship-advice-get-in-a-fight.html,Podcasts,The New York Times
"Trump Transition Stalls Over Ethics Code, and a New Russian Offensive","Plus, Saudi Arabia’s “sportswashing” controversy.",2024-11-11T11:00:14Z,https://www.nytimes.com/2024/11/11/podcasts/trump-border-czar-russia-north-korea.html,Podcasts,The New York Times
"Milton’s Path of Destruction, and a First Biden-Netanyahu Call in Months","Plus, the Kenyan police battle gangs in Haiti.",2024-10-10T10:00:17Z,https://www.nytimes.com/2024/10/10/podcasts/milton-florida-biden-netanyahu.html,Podcasts,The New York Times
More Babies Aren’t the Only Solution to Falling Birthrates,Jessica Grose on the good news behind the numbers.,2024-10-23T09:08:06Z,https://www.nytimes.com/2024/10/23/opinion/falling-birth-rates-solution.html,Opinion,The New York Times
Popcast: A Word With John Summit,"The dance music superstar and former accountant speaks on the return of EDM and his rise, from underground parties to headlining Madison Square Garden.",2024-09-25T15:08:32Z,https://www.nytimes.com/2024/09/25/arts/music/john-summit-interview-popcast.html,Arts,The New York Times
