title,snippet,pub_date,web_url,section,source
7 Apple Picking Tips From the Guy Behind Apple Ratings,Brian Frange has been pontificating on apples since 2016. He has a few things to say before you hit the orchards.,2024-09-10T09:05:34Z,https://www.nytimes.com/2024/09/10/style/apple-picking-tips.html,Style,The New York Times
What to Do With That Apple-Picking Haul,Both the fruit and cider go into this supremely seasonal recipe for apple cider chicken with apples and parsnips.,2024-10-11T15:00:13Z,https://www.nytimes.com/2024/10/11/dining/what-to-do-with-that-apple-picking-haul.html,Food,The New York Times
How Healthy Are Apples?,They’re America’s most popular fruit. Here’s why that’s a great thing.,2024-09-23T09:00:25Z,https://www.nytimes.com/2024/09/23/well/eat/apples-health-benefits-recipes.html,Well,The New York Times
"U.S. Sues Apple, Accusing It of Maintaining an iPhone Monopoly","The lawsuit caps years of regulatory scrutiny of Apple’s wildly popular suite of devices and services, which have fueled its growth into a nearly $3 trillion public company.",2024-03-21T14:30:39Z,https://www.nytimes.com/2024/03/21/technology/apple-doj-lawsuit-antitrust.html,Technology,The New York Times
Apple’s Quarterly Profit Down Because of Tax Payment in Europe,Sales for the iPhone maker were up 6 percent to to $94.93 billion. But a $14.4 billion tax bill cut profits that would have topped expectations.,2024-10-31T21:10:57Z,https://www.nytimes.com/2024/10/31/technology/apple-profit-earnings.html,Technology,The New York Times
Apple and Goldman Sachs Must Pay Nearly $90 Million in Credit-Card Inquiry,"The penalties and customer refunds stem from an investigation by the Consumer Financial Protection Bureau into Apple Card, which Goldman issues.",2024-10-23T16:01:51Z,https://www.nytimes.com/2024/10/23/business/apple-goldman-sachs-fine-credit-cards.html,Business,The New York Times
Apple’s A.I. Is Landing Soon on iPhones. Here’s What It’s Like.,The initial version of Apple Intelligence focuses on helping you with words and photos. Prepare to be impressed and unnerved.,2024-10-02T09:03:09Z,https://www.nytimes.com/2024/10/02/technology/personaltech/apple-intelligence-iphone.html,Technology,The New York Times
Apple Unveils New iPhones With Built-In Artificial Intelligence,The company also showcased a new Apple Watch and AirPods that can reduce noise at concerts or near construction sites.,2024-09-09T17:33:53Z,https://www.nytimes.com/2024/09/09/technology/apple-event-iphone-16-watch.html,Technology,The New York Times
Apple and Nvidia in Talks to Invest in OpenAI,"Led by the investment firm Thrive Capital, the new deal would value the artificial intelligence start-up at over $100 billion.",2024-08-29T19:40:59Z,https://www.nytimes.com/2024/08/29/technology/apple-nvidia-openai.html,Technology,The New York Times
Can Apple’s iPhones Pass the A.I. Test?,"On Monday, the company will introduce smartphones with A.I. features that could take the technology mainstream or sow fresh doubts about its viability.",2024-09-09T07:00:59Z,https://www.nytimes.com/2024/09/09/technology/apple-iphone-ai-features.html,Technology,The New York Times
Sales of Macs and iPads Lead Apple’s Quarterly Revenue Up 5%,"While iPhone sales dropped 1 percent, consumer interest in Apple’s flagship product is expected to pick up later this year.",2024-08-01T20:59:10Z,https://www.nytimes.com/2024/08/01/technology/apple-quarterly-revenue-up-5.html,Technology,The New York Times
What to Make When You Have Lots of Apples But Absolutely No Energy,Enter: Genevieve Ko’s apple crisp.,2024-10-19T15:00:02Z,https://www.nytimes.com/2024/10/19/dining/what-to-make-when-you-have-lots-of-apples-but-absolutely-no-energy.html,Food,The New York Times
Apple Rethinks Its Movie Strategy After a String of Misses,"“Wolfs,” a new film starring George Clooney and Brad Pitt, was going to get a robust theatrical release. But the company is curtailing that plan.",2024-08-25T09:00:47Z,https://www.nytimes.com/2024/08/25/business/media/apple-movies-theaters-wolfs.html,Business,The New York Times
Apple Killed Albums. Now It Wants to Rank Them.,Wesley Morris on the injustice and absurdity of Apple’s Top 100.,2024-09-30T09:06:01Z,https://www.nytimes.com/2024/09/30/podcasts/apple-killed-albums-now-it-wants-to-rank-them.html,Podcasts,The New York Times
Why Does My iPhone Keep Asking Me to Check In With My Ex?,"An iPhone feature has some users baffled as they are asked to share their location with work acquaintances, dead relatives and people on other continents.",2024-09-26T09:03:28Z,https://www.nytimes.com/2024/09/26/style/apple-check-ins.html,Style,The New York Times
Apple Giving Ground on App Store Rules to Appease Regulators,The company faces pressure from governments around the world and complaints from companies that it is still too restrictive.,2024-08-16T11:00:07Z,https://www.nytimes.com/2024/08/16/technology/apple-epic-spotify-app-stores.html,Technology,The New York Times
Did Apple Just Kill Social Apps?,Some app makers worry that a subtle change to the iPhone’s contact-sharing permissions could make it hard for them to get the fast growth they need to compete.,2024-10-02T14:44:11Z,https://www.nytimes.com/2024/10/02/technology/apple-social-apps-contacts-change.html,Technology,The New York Times
The Apple of One Business Reporter’s Eye,"Since 2022, Tripp Mickle has covered news surrounding one of the biggest technology companies in Silicon Valley.",2024-07-31T21:00:06Z,https://www.nytimes.com/2024/07/31/insider/apple-beat.html,Times Insider,The New York Times
Apple Settles E.U. Case by Opening Its Payment Service to Rivals,Customers in Europe may see an influx of new apps and services for making tap-and-go purchases.,2024-07-11T12:36:59Z,https://www.nytimes.com/2024/07/11/business/apple-european-union-antitrust.html,Business,The New York Times
Apple Jumps Into A.I. Fray With Apple Intelligence,"The iPhone maker, which has been slow to embrace artificial intelligence, will weave it into the technology that runs on billions of devices.",2024-06-10T18:48:32Z,https://www.nytimes.com/2024/06/10/technology/apple-intelligence-openai.html,Technology,The New York Times
Apple Store Workers Get First U.S. Contract,"The agreement at a Maryland store, the first to unionize, raises wages roughly 10 percent over three years and guarantees benefits and severance pay.",2024-08-07T00:53:05Z,https://www.nytimes.com/2024/08/06/business/economy/apple-store-union-contract.html,Business,The New York Times
Apple Is First Company Charged Under New E.U. Competition Law,"The company’s App Store policies are illegal under the European Union’s Digital Markets Act, according to regulators in Brussels.",2024-06-24T08:12:26Z,https://www.nytimes.com/2024/06/24/technology/apple-european-union-competition-law.html,Technology,The New York Times
How Do You Restore a Chestnut Forest or an Apple Orchard? Very Slowly.,This botanic garden is determined to bring back the American chestnut tree and heirloom apples that taste like those grown 500 years ago. It won’t be easy.,2024-07-03T09:00:45Z,https://www.nytimes.com/2024/07/03/realestate/new-england-botanic-garden-chestnut-apple.html,Real Estate,The New York Times
Google and Apple Face Billions in Penalties After Losing E.U. Appeals,"The cases had established the European Union as the world’s leading tech watchdog, but have since raised questions about its protracted appeals process.",2024-09-10T08:17:12Z,https://www.nytimes.com/2024/09/10/technology/european-union-apple-google-antitrust.html,Technology,The New York Times
"Big Apple Circus Review: A City Tour, Pizza Rats Included",This year’s show is an underwhelming exercise in nostalgia. But it’s still a joy to be under the big top with acts like the Wheel of Destiny.,2024-11-13T18:07:03Z,https://www.nytimes.com/2024/11/13/theater/big-apple-circus-review.html,Theater,The New York Times
"Hey, Siri! Let’s Talk About How Apple Is Giving You an A.I. Makeover.","Apple, a latecomer to artificial intelligence, has struck a deal with OpenAI and developed tools to improve its Siri voice assistant, which it is set to showcase on Monday.",2024-06-09T09:04:03Z,https://www.nytimes.com/2024/06/09/technology/siri-apple-ai-chatgpt.html,Technology,The New York Times
"After Apple, Jony Ive Is Building an Empire of His Own","Five years after leaving Apple, the iPhone designer is forging a new life in San Francisco, one imaginative building at a time.",2024-09-21T09:00:23Z,https://www.nytimes.com/2024/09/21/technology/jony-ive-apple-lovefrom.html,Technology,The New York Times
That Much-Despised Apple Ad Could Be More Disturbing Than It Looks,Tech companies are running low on new experiences to offer us. A new ad for the iPad contains revealing hints of where they could go next.,2024-06-06T09:01:04Z,https://www.nytimes.com/2024/06/06/magazine/apple-ipad-ad.html,Magazine,The New York Times
Some iPhone Customers Could Get Up to $349 in an Apple Settlement,"A class-action lawsuit about audio issues in iPhone 7 and 7 Plus phones has led to a $35 million settlement, though the company denies the phones were faulty.",2024-05-23T20:41:20Z,https://www.nytimes.com/2024/05/23/business/apple-iphone-settlement.html,Business,The New York Times
Apple Says Destructive iPad Ad ‘Missed the Mark’,People in the creative world widely panned a commercial showing a giant hydraulic press squishing objects ranging from paint cans to a piano.,2024-05-09T22:10:03Z,https://www.nytimes.com/2024/05/09/technology/apple-ipad-ad-crush-apology.html,Technology,The New York Times
Apple Reports Decline in Sales and Profit Amid iPhone Struggles in China,"The company continues to lean on customers’ appetite for apps and services, as demand for its devices weakens.",2024-05-02T21:04:45Z,https://www.nytimes.com/2024/05/02/technology/apple-earnings-china.html,Technology,The New York Times
Apple’s New iPad Ad Leaves Its Creative Audience Feeling … Flat,An ad meant to show how the updated device can do many things has become a metaphor for a community’s fears of the technology industry.,2024-05-08T23:45:31Z,https://www.nytimes.com/2024/05/08/business/apple-ipad-crush-ad.html,Business,The New York Times
Can Apple Rescue the Vision Pro?,"The $3,500 “spatial computing” device has gathered dust on my shelf. Can tweaks and upgrades save it from obsolescence?",2024-06-11T09:00:41Z,https://www.nytimes.com/2024/06/11/technology/apple-vision-pro-needs.html,Technology,The New York Times
Berkshire’s Cash Stockpile Soars as It Cuts Its Stake in Apple,"The conglomerate reported nearly $277 billion in cash in the second quarter. And while it sold about 390 million shares in Apple, it still owned about 400 million.",2024-08-03T14:29:15Z,https://www.nytimes.com/2024/08/03/business/berkshire-hathaway-buffett-earnings.html,Business,The New York Times
Apple Will Revamp Siri to Catch Up to Its Chatbot Competitors,Apple plans to announce that it will bring generative A.I. to iPhones after the company’s most significant reorganization in a decade.,2024-05-10T18:00:37Z,https://www.nytimes.com/2024/05/10/business/apple-siri-ai-chatgpt.html,Business,The New York Times
Apple Lifts Some Restrictions on iPhone Repairs,"This fall, the company will begin allowing customers to replace broken parts with used iPhone components without its previous software limits.",2024-04-11T18:50:30Z,https://www.nytimes.com/2024/04/11/technology/apple-iphone-repairs-parts.html,Technology,The New York Times
"After Google Antitrust Ruling, Here’s Where Other Big Tech Cases Stand","The federal government has more lawsuits in the pipeline trying to rein in the tech giants, including another antitrust case against Google that goes to trial next month.",2024-08-05T20:14:46Z,https://www.nytimes.com/2024/08/05/technology/antitrust-google-amazon-apple-meta.html,Technology,The New York Times
FIFA Said to Be Close to TV Deal With Apple for New Tournament,The agreement would give the tech company worldwide rights for a monthlong World Cup-style competition between top teams set to take place next year.,2024-04-22T15:54:35Z,https://www.nytimes.com/2024/04/22/business/fifa-apple-tv-deal.html,Business,The New York Times
Welcome to the Era of the A.I. Smartphone,"Apple and Google are getting up close and personal with user data to craft memos, summarize documents and generate images.",2024-06-10T20:28:25Z,https://www.nytimes.com/2024/06/10/technology/personaltech/apple-google-ai.html,Technology,The New York Times
24 Hours at the Golden Apple,"One day in a Chicago diner, starting at 5 a.m. and going until 5 a.m. the next morning.",2024-07-27T10:39:06Z,https://www.nytimes.com/2024/08/25/podcasts/24-hours-at-the-golden-apple.html,Podcasts,The New York Times
Coming to ‘iPhone City’: An Electric Car Factory From Foxconn,"The Taiwanese company has built a manufacturing hub in Zhengzhou, China, for its star customer Apple, but it is starting almost from scratch in the auto business.",2024-08-14T18:00:12Z,https://www.nytimes.com/2024/08/14/business/china-foxconn-apple-ev.html,Business,The New York Times
Apple Says It Was Ordered to Pull WhatsApp From China App Store,"Apple said it removed WhatsApp and Threads from its China app offerings Friday on Beijing’s orders, amid technological tensions between the U.S. and China.",2024-04-19T03:32:43Z,https://www.nytimes.com/2024/04/18/technology/apple-whatsapp-china-app-store.html,Technology,The New York Times
Apple and Google Are Discussing a Deal to Bring Generative A.I. to iPhones,A partnership would extend the long relationship between the companies that has helped deliver everything from maps to search on Apple’s devices.,2024-03-19T17:35:01Z,https://www.nytimes.com/2024/03/19/technology/apple-google-ai-iphone.html,Technology,The New York Times
"Justice Dept. Sues Apple, Smartphones and Children with Jonathan Haidt and Reddit’s I.P.O.",“We’ll see you in court.”,2024-03-22T09:07:23Z,https://www.nytimes.com/2024/03/22/podcasts/hard-fork-apple-lawsuit-reddit-ipo.html,Podcasts,The New York Times
Microsoft and OpenAI’s Close Partnership Shows Signs of Fraying,The “best bromance in tech” has had a reality check as OpenAI has tried to change its deal with Microsoft and the software maker has tried to hedge its bet on the start-up.,2024-10-18T00:56:11Z,https://www.nytimes.com/2024/10/17/technology/microsoft-openai-partnership-deal.html,Technology,The New York Times
Apple Keeps Losing Patent Cases. Its Solution: Rewrite the Rules.,"After losing two complaints before the U.S. International Trade Commission, Apple has stepped up its lobbying to change the agency’s practices.",2024-03-19T17:48:47Z,https://www.nytimes.com/2024/03/19/technology/apple-patents-lobbying.html,Technology,The New York Times
Apple’s Problems Around the Globe Are Piling Up,The Justice Department’s lawsuit against Apple is the latest in a series of regulatory actions that are hitting the tech giant at the same time.,2024-03-21T17:38:43Z,https://www.nytimes.com/2024/03/21/technology/apple-regulators-world.html,Technology,The New York Times
"Israeli Hostage Rescue Fallout, and Far Right Wreaks Havoc in Europe","Plus, Apple’s Siri gets an A.I. makeover.",2024-06-10T10:00:07Z,https://www.nytimes.com/2024/06/10/podcasts/israel-hostages-apple.html,Podcasts,The New York Times
Apple Reverses Course and Allows Epic Games to Start Competing App Store,"After an inquiry by European regulators, Epic Games said Apple would allow it to access the software tools necessary to develop a game store.",2024-03-08T19:41:06Z,https://www.nytimes.com/2024/03/08/technology/apple-epic-games-app-store.html,Technology,The New York Times
"U.S. to Push For Gaza Cease-Fire, Apple Gets Sued and More","Plus, don’t mess with Elvis.",2024-03-22T10:05:03Z,https://www.nytimes.com/2024/03/22/podcasts/us-to-push-for-gaza-cease-fire-apple-gets-sued-and-more.html,Podcasts,The New York Times
The Cutting-Edge Hearing Aids That You May Already Own,Apple is preparing to turn its AirPods Pro 2 into easy-to-use aids for people with mild to moderate hearing loss.,2024-10-12T13:35:39Z,https://www.nytimes.com/2024/10/12/health/apple-airpods-hearing-aids.html,Health,The New York Times
Apple Kills Its Electric Car Project,"The car, which Apple spent billions of dollars researching, had been intended as a rival to Tesla’s E.V.s, which include autonomous driving features.",2024-02-27T20:47:02Z,https://www.nytimes.com/2024/02/27/technology/apple-ends-electric-car-plan.html,Technology,The New York Times
‘Midnight Family’ Is a Fresh and Energetic Medical Drama,"Set among a family of private ambulance drivers in Mexico City, the Apple TV+ series is a thoughtful and cinematic adaptation of a 2019 documentary.",2024-11-21T21:59:47Z,https://www.nytimes.com/2024/11/21/arts/television/midnight-family-apple-tv-plus.html,Arts,The New York Times
Apple Blocks Epic Games From Using iPhone Tools in Escalation of Feud,"The move tests the European Union’s new tech competition law, which was designed to allow competing app stores.",2024-03-06T17:46:28Z,https://www.nytimes.com/2024/03/06/technology/apple-epic-games-feud.html,Technology,The New York Times
Read the Lawsuit Against Apple,The suit is the federal government’s most significant challenge to the reach and influence of the company.,2024-03-21T14:52:00Z,https://www.nytimes.com/interactive/2024/03/21/technology/apple-lawsuit.html,Technology,The New York Times
Is Apple Cider Vinegar Really a Cure-All?,"It has been said to help with weight loss, blood sugar control, acne and more. But experts say the science is more nuanced.",2024-04-09T09:00:30Z,https://www.nytimes.com/2024/04/09/well/eat/apple-cider-vinegar-benefits.html,Well,The New York Times
The Second Coming of the Microsoft Antitrust Battle?,Prosecutors compare their new fight against Apple to the seminal case against Windows in the 1990s.,2024-03-23T12:00:05Z,https://www.nytimes.com/2024/03/23/business/dealbook/apple-microsoft-antitrust.html,Business,The New York Times
‘Pachinko’ Is a Gorgeous Epic of Love and Struggle,"Based on the novel by Min Jin Lee, this thoughtful series about a Korean family across generations returns to Apple TV+ for a second season.",2024-08-22T20:46:20Z,https://www.nytimes.com/2024/08/22/arts/television/pachinko-season-2-apple.html,Arts,The New York Times
"Apple Joins the A.I. Party, Elon’s Wild Week and HatGPT",“They really sort of make you feel like it’s Christmas and Coachella at the same time.”,2024-06-14T09:06:07Z,https://www.nytimes.com/2024/06/14/podcasts/hardfork-apple-intelligence-elon-musk.html,Podcasts,The New York Times
Season 2 of ‘Bad Sisters’ Is Still Stylish and Thrilling,"There is a sense, however, that the most important events in this offbeat Apple TV+ drama happened in Season 1.",2024-11-14T18:13:28Z,https://www.nytimes.com/2024/11/14/arts/television/bad-sisters-season-2-apple-tv-plus.html,Arts,The New York Times
Apple Fined $2 Billion by E.U. for Using App Store to Thwart Competition,"Apple said it would appeal the penalty, the latest in a series of regulatory setbacks for the tech giant.",2024-03-04T12:13:58Z,https://www.nytimes.com/2024/03/04/business/apple-eu-fine-app-store.html,Business,The New York Times
Behind Apple’s Doomed Car Project: False Starts and Wrong Turns,Internal disagreements over the direction of the Apple car led the effort to sputter for years before it was canceled this week.,2024-02-28T23:02:22Z,https://www.nytimes.com/2024/02/28/technology/behind-the-apple-car-dead.html,Technology,The New York Times
Apple’s European Headache,"The iPhone maker is the first U.S. tech giant charged with breaching the European Union’s Digital Markets Act, potentially exposing it to huge fines.",2024-06-24T11:32:36Z,https://www.nytimes.com/2024/06/24/business/dealbook/apple-europe-antitrust-dma.html,Business,The New York Times
Can Apple Think Different on A.I.?,Wall Street and Silicon Valley will be watching the company’s developers conference closely for signs of whether the iPhone maker can finally catch up on artificial intelligence.,2024-06-10T11:31:25Z,https://www.nytimes.com/2024/06/10/business/dealbook/apple-ai-siri.html,Business,The New York Times
Hate Noisy Restaurants? Stick This in Your Ear.,Apple earbuds and others can help you hear dining companions. Here’s how to use them.,2024-10-18T09:04:37Z,https://www.nytimes.com/2024/10/18/dining/noisy-restaurants-apple-airpods.html,Food,The New York Times
"E.U. Takes Aim at Alphabet, Apple and Meta in Wide-Ranging Investigations",The inquiries signal the bloc’s intention to tightly enforce sweeping new competition rules that took effect this month.,2024-03-25T11:44:47Z,https://www.nytimes.com/2024/03/25/business/apple-facebook-google-eu-investigation.html,Business,The New York Times
How to Turn Your Old iPhone Into an A.I. Phone (and Skip the Upgrade),"Apple is using Apple Intelligence, a suite of tools for generating images and text, to upsell the iPhone 16. But you can get similar features elsewhere.",2024-09-09T17:53:47Z,https://www.nytimes.com/2024/09/09/technology/personaltech/iphone-ai-upgrade.html,Technology,The New York Times
Berkshire Continues Retreat From Stocks,The conglomerate reported on Saturday that it had cut its holdings in Apple and Bank of America and increased its cash to a record high in the third quarter.,2024-11-02T14:29:11Z,https://www.nytimes.com/2024/11/02/business/berkshire-hathaway-warren-buffett.html,Business,The New York Times
The United States vs. the iPhone,Washington’s crackdown on Big Tech is coming for Apple.,2024-03-26T10:00:13Z,https://www.nytimes.com/2024/03/26/podcasts/the-daily/apple-lawsuit.html,Podcasts,The New York Times
Apple Sees First Quarterly Revenue Increase in a Year,The iPhone maker’s share price dropped in after-hour trading even though sales and profit topped Wall Street expectations.,2024-02-01T22:05:44Z,https://www.nytimes.com/2024/02/01/technology/apple-earnings-iphone.html,Technology,The New York Times
"‘La Maison’: Like ‘Succession,’ but Better Dressed (and French)","The new Apple TV+’s new series takes the viewer inside two rival Paris fashion houses, with gorgeous people in gorgeous clothes who will do anything for power.",2024-09-20T08:33:52Z,https://www.nytimes.com/2024/09/20/arts/television/la-maison-apple-tv.html,Arts,The New York Times
How the Fight Against Apple Could Redefine Antitrust Law,The Justice Department’s lawsuit against the iPhone maker pushes the boundaries of competition rules. Some experts say that may make winning more difficult.,2024-03-22T12:03:37Z,https://www.nytimes.com/2024/03/22/business/dealbook/apple-justice-antitrust.html,Business,The New York Times
Tech Giants Face a Familiar Uncertainty With Trump,"Apple, Amazon, Google, Meta and others learned during the last Trump administration to expect the unexpected when it came to Washington scrutiny and support.",2024-11-07T10:04:59Z,https://www.nytimes.com/2024/11/07/technology/trump-apple-amazon-google-meta.html,Technology,The New York Times
‘Me’ Is a Lovely and Distinctive Tween Drama,"Anchored by beautiful performances, this Apple TV+ superhero show surpasses its own genre clichés.",2024-07-11T18:33:14Z,https://www.nytimes.com/2024/07/11/arts/television/me-apple-tv-plus-superhero.html,Arts,The New York Times
Apple Takes Messaging Crackdown to Customers’ Macs,"Beeper Mini customers were using their Mac computers to connect to iPhone messaging on their Android phones. Now, they say Apple has blocked the messaging service on their Macs.",2024-01-26T16:20:53Z,https://www.nytimes.com/2024/01/26/technology/apple-messaging-crackdown-beeper.html,Technology,The New York Times
Apple Says It Will Remove a Health Feature From New Apple Watches,"Starting on Thursday, the Apple Watch Series 9 and Watch Ultra 2 will no longer detect people’s blood oxygen levels, to comply with a ruling by the International Trade Commission.",2024-01-17T22:35:09Z,https://www.nytimes.com/2024/01/17/technology/apple-watch-oximetry-international-trade-commission.html,Technology,The New York Times
Breaking Up With China Is Hard to Do,"For many U.S. companies, Chinese partnership may be too important to quit.",2024-09-30T19:00:03Z,https://www.nytimes.com/2024/09/30/opinion/american-businesses-china.html,Opinion,The New York Times
Apple Has a New Plan for Its App Store. Many Developers Hate It.,"To comply with European regulations, Apple has proposed reducing its commission on app sales while adding new fees and hurdles.",2024-02-01T15:44:29Z,https://www.nytimes.com/2024/02/01/technology/apple-app-store-europe.html,Technology,The New York Times
"Can You Turn Off Big Tech’s A.I. Tools? Sometimes, and Here’s How.","Google, Microsoft and Meta are shoving A.I. chatbots into our faces. Sometimes, there’s a way out.",2024-10-09T09:05:40Z,https://www.nytimes.com/2024/10/09/technology/personaltech/turn-off-ai-overviews-google-meta.html,Technology,The New York Times
Apple’s Go-Slow A.I. Approach,"The tech giant announced a slew of artificial intelligence-focused features, but also signaled it will be patient in rolling out the technology to users.",2024-06-11T11:46:02Z,https://www.nytimes.com/2024/06/11/business/dealbook/apple-go-slow-ai-approach.html,Business,The New York Times
"Abortion Access on the Ballot, and Hamas Won’t Attend Peace Talks","Plus, new details on Hunter Biden’s business dealings.",2024-08-14T10:00:09Z,https://www.nytimes.com/2024/08/14/podcasts/abortion-arizona-hamas-peace-talks.html,Podcasts,The New York Times
Apple Entered the A.I. Fray,"Also, the F.D.A.’s advisers endorsed a new Alzheimer’s drug. Here’s the latest at the end of Monday.",2024-06-10T21:42:44Z,https://www.nytimes.com/2024/06/10/briefing/apple-ai-blinken-middle-east-tour-elephants.html,Briefing,The New York Times
